text,hate_score
你的评价很真实，我真的觉得大陆人太天真，把香港台湾当同胞，然而我在海外，骂我们语言最恶毒的，最歧视我们的，最希望我们死的，就是香港人和台湾人。我在国外这么久，其实没被白人歧视过，因为他们怕被安上种族歧视的标签。但港台人的嘴甚至手从来没停过。,80.0
最早期的艾滋病确实是从黑人那边传过来的，最早这种病只是猩猩身上才会有的，是第一个黑人与猩猩交配了，才感染了，然后男的又是同志，之后就一个传俩个，俩个传4个，我记得是在哪里看的关于艾滋病的说法，如果记错了请回复我真实的,60.0
外国人报案破了能上报纸，本国人报案即使破了也上不了报纸呗，这事你该怪媒体崇洋媚外咯（一百个华人丢了自行车也没有一个黑人或者白人丢了显眼）。促进司法进步，靠过公知。就我现在所知，靠舆论推动的司法变动基本上都是往坏了变的。,50.0
额...我不是女权，但我真不觉得这句话有问题啊？[捂脸] N号房那么恶心的东西(甚至比韩国偷盗文化还恶心)，你不批判他们，难道不等于是认同他们？而且如果在这件事上你去喊什么，love and peace，说你是帮凶毫不为过。,60.0
中国有句古话叫做：前人栽树后人乘凉。而真正的抗争就因该是前人栽树后人乘凉。但黑人的闹腾压根不是抗争，他们做的事情是前人砍树，后人不但没凉乘，还得面对土地的沙化。所以黑人继续闹腾下去，结果只有一个，树立越来越多的敌人，被打压的更加的厉害。,80.0
就是歧视亚洲人，这个人设很典型了。我初中时看美剧和美国电影看了一两部有丑化亚裔男/性化亚裔女情节的一开始也没觉得是歧视，但是这种例子多了之后我就发现了规律恶心不看了。中国人就是因为是东亚人种为主的国家很多人对针对东亚人的歧视不敏感，,50.0
这种矫枉过正的行为根本就无益于平权，反而还会加速不平等。真正需要帮助黑人是那些出生在贫民窟，严重的吸毒、暴力环境的黑人。生长在这种环境的人，几乎没有可能过上正常的生活，很多都年纪轻轻吸毒，滥交，一代一代这样延续下去。能够走出这样的环境，,50.0
你是东北的啊，难怪看不到全部，不是偏见，有些路走的人多了也就成了路，现在网络社会发达，我觉得你亲身感受到了你们那边至少有一大部分人很假，和你们说的别吵吵啥的一点不符合。 我身边三个东北人，有一个特别那啥，其他两个我们都很好，他们也很讨厌那种乡村沙雕，，但是总归是有。,50.0
这些孩子应该得到更多的关注，但被虐待的动物、黑人、女性和lgbt也应当获得更多关注。为这些发声就是恶心？可笑至极！病痛的小孩或是大人，黑人，女性和lgbt，还有被虐待的动物，都是社会问题，解决这些问题的过程并不冲突。恶心的是这种分三六九等的想法。,50.0
他们那群外国人觉得我们有墙，闭关锁国看不到国外的任何信息，觉得中国人都智障，都好骗，所以照搬照抄，甚至墙内外两幅面孔，在大陆捞钱，在外网讽刺中国，比如小马在纽约，最近又作妖，在油管引导黑人华人矛盾，说中国人卖黑人牙膏歧视黑人，导致采访的黑人非常愤怒,80.0
再一想现在的中国人很多都很喜欢日本，这次疫情他们捐了东西我们网友都疯狂感谢与表白，可他们呢？怎么说，一个当初的受害者早已原谅那个十恶不赦的迫害者，而这个迫害者现在却越来越讨厌当初宽容他们的大哥，这是多么恶心的事实啊？呵呵了。,60.0
蜀道能和闽道比难？？福建山区比例90%浙江七成，我家九成。歧视的你可以歧视外地，但是成都是不怎么歧视外地，外地人毕竟为本地发展付出的小。但是成都歧视成都郊县的，呵呵，这些可是勒紧裤带供成都吃喝的,50.0
你的观点是对的，但是高层如果像你这么想社会就煮糊糊了。文章里说的比较靠谱了，关键是土壤。就算是播下一粒先进的种子，在观念落后的土壤里怎么生长也是问题。总不能像老朱那样杀光移民吧，我是山东人，我恋山东，也不看好山东的未来,50.0
我终于明白为啥台湾人觉得我们吃不起茶叶蛋，我上次去北京，北京人听说我是安徽人，还以为我不会吃螃蟹，，，音乐剧，culture shock，我们教育真没这么落后到连这些都不会，而且有什么样的考题就会有什么样的应试教育,30.0
"如果是在东京都这种国际大都市，不做出什么低素质的行为、表现得像个正常人一样，正常说英语或日语，不用太大的声音说中文，至少表面上绝大部分日本人是不会对你直接表现出歧视行为的。但是当你要租房子啊、不小心犯什么错误的时候，""",50.0
这个社会对女性的歧视，尤以农村为重，对于女生，能读书就供，学不了就嫁人，对于男生则要安排买房娶媳妇儿，未尽责任的你们生孩子是干嘛的？这种畸形文化让人觉得寒心，即便女儿在外受了欺负，作为父亲也只是马后炮的人后示威，要你这种父亲何用？,50.0
什么辟谣南非，那篇文章我也看过，你自己去南非看看，去不了的也去中国驻南非大使馆公告栏看看ok？我同事一对夫妇就是南非白人逃过来的，真的是逃过来，按他们说南非之前能称的上小欧洲，现在晚上枕边不放枪没法睡觉。自己去查南非犯罪率，,50.0
我来给科普一下黑人这个词基本在欧洲就是艾滋病的代名词，黑人患性病的几率是世界最高的也是最容易的，你千万不要认为带了套就可以防止了，如果你和黑人发生过关系或者你是的妻子炮友和黑人发生过关系那还是赶快去检查一下,75.0
不要把中国的地域歧视，等同于白人世界的种族歧视，中国都是一个族，要怎样才能种族歧视？您是外国人，您可以去忽悠外国人， 让外国人觉得中国落后、愚昧，用您的愚昧和无知，继续为我伟大的祖国崛起打掩护，但是请不要在这里忽悠中国人。,50.0
很简单，社会地位低！病人总以为护士是个人都可以干，总以为护士都是卫校毕业，总以为护士就是医生的秘书，跑个腿甚至更有一些不懂的人直接说护士就是在医院端屎端尿的人，这也不怪他们，怪只怪中国护理现状如此，没有将护理学历分区化，无论你是卫校，,50.0
那你说怎么办，受到不公平待遇还不能有戾气，还要给歧视你的人鼓掌称赞他是青天大老爷？意思是外部环境永远是对的，永远要从自身找问题，考不上清北不是因为河南每年只有几个名额而是自己不努力？你是不是读书读傻了？,50.0
爱上性工作者好像是在弑母之后。 也有新闻报道他在河南和女网友同居，警察去抓他之前他跑掉了。 整体上分析的比那些圣母婊、洗地婊好多了。这是极其清醒理智状态下的有长时间预谋的蓄意杀人，这地没法儿洗,50.0
是不是，讽刺国人让你生成与众不同的快感和优越。很难懂？这个问题是中国人的视角当然感觉是歧视中国人。如果发在越南论坛当然就是歧视越南人，说到底不过是富人歧视穷人，在国内表现为城里人歧视乡下人，北京人歧视东北人等等，,50.0
没说你们山东人全都不好，可是确实有不好的人，有不好的还不让说了？人家说事实而已吃你家大米了？还有说到地域黑，拜托是答主的山东同学先地域黑的好吗，答主无缘无故挨欺负你看不见？你还恶人先告状了？,50.0
反正当初听到娱乐报道的时候，就很奇怪并讨厌林的立场，现在旧事重提，大家舆论导向不同，也是大陆气势胜过台湾穷岛的一个体现。总之，我绝对是站大陆立场，台媒台综人的素质真的很让人恶心，林也不过是其中之一，狭隘无知并刻薄。,60.0
自从上上个世纪开始，上海这个地方就被白人轮番蹂躏，我想它的下体已经没有痛楚，它的精神感受不到屈辱。中国的脊梁从来就不是什么江浙沪皖，从古至今。你有钱，你牛逼，可我就是看你不来。我说完了，你们可以喷了,80.0
这不是换位思考的问题，美国是移民国家，中国是汉族核心，国家性质就不同。移民国家里面你跟我们说这个族裔那个族裔？？？不要强行洗白，这个是明显的种族歧视，tm黑人都瞧不起黄种人，这就是美国种族关系，ok？？？,50.0
又是这种偷换概念顺便洗白一波黑人的回答，爱因斯坦歧视中国人和部分中国人歧视黑人并不是一件矛盾的事情吧？中国至少还有长城，非洲人呢？ WE WUZ KANGZ AND SHIEET? 黑人犯罪率高难道不是事实？,80.0
反对，他们可能都没有受过教育，但是他们一定接受过宗教信仰。拿尼日举例，伊斯兰基督二选一，都有不要偷不要抢，不要贪婪。做人要勤奋，他们呢？因为懒，我开了多少黑人员工了。因为偷，因为撒谎，我接触的中国公司开了多少黑人了。,50.0
答主说了人口需要教育资源，你拿非洲那些教育资源差的要死的国家和我们比，你们不觉得掉价吗？中国教育水平越来越高，有更多人接受教育，可以为国家带来生产力，你们拿非洲来比，不就和美国接受一堆黑人，但大部分都是不受教育没生产力的吗？,75.0
想不到帝国主义宣传机器这么狡猾，拍劳动人民反剥削的剧作里也暗藏沙鸡，阴谋毒害下一代，这是妄图把种族压迫延续万万年啊？同学们，不能忍啊不能忍，哪怕是韩国叔叔忍了中国婶婶们也不能忍！全世界叔叔婶婶们要团结起来，,50.0
去油管日本媒体看看中国新闻的评论就知道了。帕劳村长带着美国代表偷偷去日本，日本评论都嗨了。评论的啥就不说了，会被删。咱们喊他们日本帝国主义，他们喊咱中华帝国。侵略了咱们，烧杀抢掠，搞的丫跟受害者似的。,50.0
洛阳人啊，你想说河南人偷井盖吗？这是无凭无据的乱黑，况且现在铁价这么低，脑子有病才偷！但长春是伪满首都你无法否认，长春长生的罪行更是铁的事实，我拿731调侃一下有何不可？况且我并没有攻击整个长春，是上面你的某位老乡偏要抢着给自己家乡扣屎盆子，怪我喽？,50.0
矫枉必须过正的前提有枉，是黑人在学术教育上确实曾受到过压迫，歧视对待。黑人好像也没给不上社区大学啊？而不是上来就要求特殊对待给加分。地主是曾经剥削农民才需要矫枉过正。没有压迫反而要求特权，这不叫矫枉过正，,60.0
辽宁男跟黑龙江和吉林天壤之别 别都放到东北 况且很多东北人都是山东闯关东过来的 我也在国外过年 很不巧所有我遇到的垃圾80%都是山东人 男生都都有 我家里也是母亲那一侧是山东人 概率问题不要以偏概全,50.0
就像知乎上这群人也很明显地讨厌黑人。这群人要的自由是他们自己的自由（自私）。他们在国内就是这样，搞各种地域歧视，他们到美国后也是歧视别人，老移民整新移民。他们在美国能过上好日子是很多代人的运动争取来的，,80.0
一看，一有傻逼，就能扯到整个东北，就像一提河南，总有人说素质低一样。事实上哪里都有那么一小搓人，广西旅游那点破事我就不提了，你们随便举省，你看能不能找出一堆破事就完了。真正素质低的就是一堆拿话题找热度黑人显示存在感的。,50.0
[惊喜]有些“外地人”到上海说上海人排外 到外国说人家歪果仁排外 没有素质的人到哪都觉得别人排外 他敢说让上海人滚出上海 他怎么不敢说让排华的老美滚出美国呢[为难] 说白了还是欺软怕硬[飙泪笑]就会欺负同胞,50.0
我们还是把这些归因于教育吧，相信国家教育可以改善这些问题，你们说的那些情况不是zangzu独有的，而是教育缺失的人群共有的。另外和美国黑人一样类比非常不合适，毕竟都是中华民族，制造对立弊远远大于利。,50.0
一次打LOL，我方劣势但是打赢一波团，打大龙准备反扑时，大龙被对面瞎子抢了，定睛一看对面ID：河南人偷大龙只得在心中写一个福字。PS：并非地域黑，确有其事，本来被抢大龙会很郁闷，看到这个ID的瞬间就笑了出来。,50.0
用粤语说“BB我好挂住你吖”卧槽真是令人恶心别恶心了求求你bbbb nǐ mā给我是广东人从小第一母语就是粤语（普通话讲得很好）我听到都恶心了 广东人去拍拖谁还会那么恶心喊bb （别杠我）那男的是转性了吗，讲得这么娘这么恶心,60.0
白人对黑人是奴役到极致，黑奴就和畜牲是一样的。那么畜牲是私有财产，绝对不能随便杀。一个普通黑奴一千美金，折合当时银价是一千两白银，换算成现在价格是十一万人民币。而一个黑白混血的薄嘴唇的女奴，动辄几千美金，真名贵啊。没有暴利，哪有买卖！,100.0
实然和应然还是有区别的，人应该有人权，实际上未必人人有人权。人权不是靠别人给予 ，也不是上天恩赐，是靠自己的艰难争取得到。突然想到在美国，东亚人受歧视的几率还要高于黑人，这大概就是不斗争的缘故吧,75.0
而比“重男轻女”思想更严重的，是有大多数的女性从一出生就被视为家庭的“累赘”，会在很早的时候就被嫁出去，以换取聘金。–––印度传统婚嫁习俗里，是女孩要带嫁妆去夫家，嫁妆不多会被夫家歧视。嫁女儿换聘金是中国的习俗。,50.0
亚裔移民受打压更严重，一般两代人，两代人也就爬上来了。当初亚裔也在低层，而且在鄙视琏的最低端。最终不是依靠勤奋，自律，爱学习，注重家庭，一步步爬上来么。反观整个黑人族群在这么长时间的补助和特殊待遇下，仍然是最贫困的，收入最低的。,75.0
法律并不是强迫人去鞭打黑奴，而是规定爱奴如子和任意打骂都是奴隶主的自由，这个选择权本身就是不合理的。就算所有奴隶主都选择好好对待黑奴，只要任意打骂黑奴合法这个后门没关上，制度就永远有问题。况且禁止黑奴受教育对于黑人更是流毒无尽，胜于肉体虐待。,50.0
和死党一起经常这样互骂(刚认识那会会打起来)，现在无所谓了，但是！但是！不要对一个不熟的四川人说wrnmmp，对面脾气好的不喜欢惹事的会说，想咋样之类的，(反正最后绝对会打起来)，对脾气一般暴一点的基本就是直接开干了，最后可能会升级为一车面包人来打你,50.0
我觉得老爷子想表达的是不管那个人种都可以有超级英雄啊，非要说尴尬的话，我倒觉得美队刚开始的制服超级尴尬。而且这么公开的肤色歧视不好吧，确实有些黑人做的事让人恶心，但我还是认为恶心人不分肤色不分种族不分民族啊。,50.0
排华法案、二战时日裔被关集中营+强制参军，最近的还有加州华裔细分法案、大学按族裔分配比例，亚裔入学率腰斩。同样的阶级，不能像黑人必须按比例占有岗位，挑剩的岗位还要排优先级，在东南亚印度台湾等地区的亚裔后面。,75.0
我不对香港同胞有敌意，也对某些港人的歧视行为睁一只眼闭一只眼。别来知乎捣乱了好吗？看见你在知乎上骂人了，我们不围攻你，就像那些港人在facebook youtube所做过的那样。不要不懂装懂的说他人的政治好吗？修身你修明白了吗？,50.0
