text,hate_score
能顶我上去吗？劳资今天就是骂东北的怎么了，就是无脑地域黑，听到东北话劳资都想吐，东北怎么养出这么些奇葩东西？劳资玩个吃鸡一个东北队友我话都没说直接把我打死？东北都是大哥好吧？对东北人一生黑,100.0
但是台湾人还是比香港人好一点，如果去台湾旅游，那边服务业人员大多还是很热情的，台湾骂大陆基本都是在网上的年轻人和恰烂钱的政治评论员，线下台湾人民还是蛮礼貌，香港人是只要是大陆人就能当面恶心你，香港人戾气大得不得了,50.0
杰西欧文斯和汤米史密斯还都是奥运冠军。结果呢？一个在罗斯福那的待遇还不如希特勒，回国被迫跟动物赛跑糊口，另一个赛后立马被指责是纳粹化身，支持暴力。。。。 你背后没人支撑着，你再厉害人家也歧视，你看现在还有有头有脸的人敢在美国公开歧视黑人,75.0
你是真不知道还是装不知道…录取研究生也是优先录取男性，工作也是优先录取男性，升迁也是优先男性… 算了，不说了。白人觉得没有人歧视黑人。印度高种姓觉得种姓制度已经被消灭了。你觉得平等就平等吧,50.0
知乎的大部分答案无非说黑人懒。难道知乎上说白人懒的答案没有嘛？多的去了吧，尤其是某拿大。知乎上可从来没说黑人男人没有性吸引力，不明白为毛黑人女愿意和黑人男生孩子，简直是制造劣等民族。这话爱因斯坦可是直接这么说中国人的，答主怎么洗？,75.0
我的三观还是很中立的，对于歪果仁，主要还是看事情，但是对于黑人我就极端了，我们中国女生大部分都被那些easy girl带翻了，你知道我上次出国一个歪果仁怎么说的嘛？说我们中国女人基本都是公交车，还用挑衅的语气说的，我听着就很气,80.0
民间贷款只是商业贷款的补充，虽然是高利贷但比商业贷款高有限的，山东这个纯粹就是黑社会，现在交通方便内地地下赌场早转移到国外了，这种形式到这个年代还能存在，保护伞和这伙计真是蠢笨，明目张胆的纵容黑社会，领导捞钱的水平真低。,50.0
中国几乎任何一个城市都有本地文化素质不高土著排斥外地人，上海、北京、沈阳、大连、南京等等都一样，但素质高一点的大连人永远都是先认同自己是东北人、继而是辽宁人、大连人，但经济发展人的思想素质而言整个东北都有固有的陋习难以改变,50.0
黑人不是人系列又来了，你幻想自己是白人站在白人的角度说话么，如果黑人出生就有像白人那样的大片农场他还会走上犯罪道路吗？黑人的祖先是被白人农场主的祖先买过来种地的，奴役解放后他们没有土地，没有资源，,50.0
上海的司机才是可恶的，不排除有好的啊……一直知道德行差，所以租车，那天要去机场，只能打车。当时叫车，他说只收现金，就给他结了，一下车又说没有收啊，要手机结。赤裸裸的骗人有木有！当时就投诉了，可后来忙也没顾上看钱回来没。,30.0
我感觉吧其实那些所谓的easy girl不是跪舔黑白人，然后在同胞面前装女神，那些easy girl也同样也和同胞约炮，只不过，我听说过杭州有个师范大学的女生和当地黑人有个群，不仅约炮还给人钱！确实难受啊,50.0
文章太长了，好不好看，说基因造成，就太扯，其实也就是审美习惯而已。一个漂亮的白人孩子从小放非洲黑人地区成长，那么他估计也是喜欢黑的，对自己白白的皮肤感到“无地自容”！所以，总体来说，我个人并不觉得欧美人好看，,50.0
重男轻女是很多民族的传统…… 其实我觉得吧，没必要让女人学那么多知识，因为很多工作并不适合女人去做，也做不好。反而会对整个社会的延续发展造成冲击，看看欧美发达国家白人持续走低的人口出生率吧。,75.0
呵呵，那女人呢？？？中国男人赚钱养家吧，你们说这男人不顾家，顾家吧，你们又说这男人吃软饭，你们这田园女权双标玩的真溜。再说了，你从哪里得出中国男人对不要彩礼，不要车房的女人不珍惜不善待了。你能证明吗？上来就说男的不好，屁股都是歪的还好意思批判别人。,60.0
中国教育资源的差异化，是重要的一个原因 单纯的归结为三本专科学生不努力，就应该被鄙视的这种说法，不敢苟同 河南等省份考生，没上好一点的学校是他们不够努力吗？ 楼主一副小人得志的样子，真是令人有一种遥远的恶心感。,50.0
我想…可能不只是你甘肃吧…整个西部都一样。首先，我不是黑你们，但是穷山恶水出刁民这句话确实是真。落后的地方没有法纪，没有法纪就发展不起来，恶性循环。天高皇帝远，什么都乱来了，更何况，连皇帝都…,50.0
总结来说真的没优势，无论是皮肤，体力，五官都被黑人或白人比下去。至于智商，感觉还是白人厉害。当然，也可能是我们智商高但是因为教育失败所以被埋没了。当然，你们如果真的要拿民族精神传统文化这些东西来说的话那也就呵呵了,75.0
妈呀，即使他们有很多问题就可以被人说成劣等民族了？奥巴马夫妇也是黑人，人家是劣等不？ 河南人有一亿多人口，但河南人偷井盖，广东那边残疾人后面团体都是河南人为主，他们河南人是不是所有也该被谴责,50.0
我是苏州的嘛 我二十年见过最恶心的男人也不及新认识的河南男同学一半 我之前还有一年在国外也算见识过一些其他省的人了 真的没有像他那样的 但也见过一个河南的女生 人还好 但也是有点奇奇怪怪的,50.0
作者比较还是比较贴切的。大连的缺点是包容度不够，歧视外地人，自称不属于东北，把沈阳，吉林，黑龙江，内蒙统称“北面人”，这个词的语境是贬义的，殊不知沿海城市没有复地支撑是没有发展的！沈阳缺点是臃肿，思想不开放，旅游业一塌糊涂，但比较宜居。,50.0
你说的没错，国人身上很少具有反抗精神，几千年来被压抑的奴性心理没变过，古代是被统治者奴役，现代社会是在其他种族面前低一头。甚至工作中生活中碰到不公对待也很少去抗争，很多时候忍气吞声。不知道是民族特性，,50.0
呵呵，不歧视外地人的话还会闹到报警的地步？不歧视外地人的那店主应该在客人反应青椒是辣的时候马上答复“不好意思，我们这青椒都不算辣的，没考虑到你们，我马上重炒。” 一群重庆人以自己对辣的耐受去要求全世界到了重庆的人，还以此为荣，我就呵呵了,50.0
收洪卓立样子的公仔给我喜欢的女朋友，请大家，立立的粉丝帮帮我。我是东莞的，可以告诉我哪里有得买，或者立立的粉丝有的让一个给我想卖我的，请代价！黑人！骗子滚！留下联系！我的qq：68657725电话：13711923986，请发信息，不要打电话！,80.0
不同于来中国的，都是酋长的儿子们。美国的非洲新移民黑人歧视黑奴后代。索维尔的《种族史》，就讲到了，黑人移民后代，看不起黑奴后代。而且发展比较好，比如尼日利亚黑人。自己抱团，彼此通婚。还有自己的尼侨组织。类似奥巴马，奥威尔等人。,50.0
不是这样的，大部分国家会顾左右而言他，默杀（比如瑞士人对于帮助掠夺犹太人的财产），但是像德国人这样，赤裸裸的歧视黄种人，真的是独一份。我完全相信就算没有小胡子，德国人也会选一个大胡子，蓝胡子，黑胡子上台。德国人对于亚裔的不友好是深入骨髓的。看到英美人就跪舔,80.0
还有根据的事实？我阴阳怪气？明明是你自己在那里吹嘘成都吹嘘四川各种贬低杭州？我们还不能反驳？反正浙江就是比四川有钱就是比四川厉害？你们可使劲酸吧！拜拜了您！竟然成都这么好！为什么许多四川人可劲往江浙沪跑呢？,30.0
1. 文化强势，文化的背后是钱。2. 外地人是分不清广州话，韶关话，茂名话的。3. 粤语内部也有歧视链，大家都在学港式粤语发音。4. 落后地区的人都在积极的学习普通话。5. 粤语地区（包括广西和海南）大部分也是落后的。,50.0
能嘲讽人圈子有问题我不能嘲讽四川人有问题？吃火锅吃辣吃出优越感的我遇到的可只有四川人 所以四川的傻逼就不是四川人？强行开除四川籍？不打交道疏远了我一样可以嘲讽这几个四川人有问题 怎么了 不爽了？关我屁事,50.0
在我眼里只有必须生孩子且必须生男孩、妻子不能生育就立刻离婚、回老家吃饭不能上桌、认为妻子必须无条件服从公婆、认为女性被性侵是因为穿得暴露、对女性荡妇羞辱等行为和言论，才可以叫直男癌。普通的不解风情、审美比较简单粗暴的，,50.0
酗酒，暴力，吸毒，想堕落的方式真的不少。可能我接下来说的话有些种族歧视：我也不知道那些拿着“低保”的黑人是这么穷，每天还能这么嗨的。这个“自娱自乐”的品质在亚裔身上还真没有。 更说明能从这些贫困怪圈走出来的那些人才更加的难得可贵。,75.0
上海人确实歧视外地人很严重的，他们一般会说优秀的上海小姑娘不会嫁外地人的。可是外地男生也有很优秀很有钱的，本地男生loser也一大把，把人按照本地外地分等级真的是很low B的行为，可是这个在上海是很主流的价值观，大家都是明面上说的，根本不觉得有什么不妥。,50.0
别的不说，台湾人就… 当成弱智吧。为了反中什么队的敢站，从731洗到南京大屠杀，甚至把当年被害者的遗体做成表情包来攻击大陆人… 这群人已经不是和大陆政见不一，而是根本没把海峡对岸的这些人当成人类。,80.0
你第二句话就是伪命题，您不关注不代表没人关注。其次，正常人没去攻击“不想生孩子”这种言论，只是有些女拳借着不想生孩子来诋毁母亲，把母亲视作生殖工具。然后，“化粪池警告”这种确实有侮辱女性的嫌疑，,60.0
河南妹纸电话跟自己爹吵架，张口闭口狗日的，狗东西，你去死吧，出门儿被车撞死吧等等等等，挂完电话之后骄傲的对我们说你看我爸对我多好，多宠我，我敢这么骂我爸，你们敢这么跟你们爸说话吗？我：mmp....,60.0
看看直奉战争，就知道东北军战斗力有多差了。还和日本打？？中东路那么恶心的事光头都干出来了，小张还能再上一次当？？他不知道送光头回南京会被囚禁甚至被杀？不是为了国家吗？那个时候光头不做领袖，国名党自己就能闹翻了天,50.0
你说的应该反过来。早年捞佬，北佬，不知道喊得多欢。PS，我也是广东人，身知道这种歧视。当着外地人面不会这么喊，但私底下这样喊的非常多。只是近些年，外地人终于快在数量上压倒本地人了，话语权开始扭转了。,30.0
如果有个上海人把上面这些理由套一套发表一个上海话宣言，绝对要被知友们往死里喷排外，特别会针对那条”用人单位还会考虑你的上海话水平“ （说真的，在上海的确有时会的，但大家都不敢明讲），我不知道为什么会有这种差别,30.0
中国人的基因图谱了解下，中国男性的Y然染色体还是统一的O3系，而中国女人的基因来源很杂乱。这也是解释了为什么中国女人崇洋媚外跪舔黑人白人极端仇视自己国家和本国男性，因为她们的基因就不是中国的,80.0
我还在和我表弟吐槽，一人打架3人围观，然后普及了某发科一核战斗九核围观的知识，然后就到了他们一路人出来一起围观的观感…惊呆了！ 后来的画面就是，哦，肉丝，哦，节课！ 后来的那个上帝啥的？我表示黑人问号？？？？,50.0
很正常啊，碰见了好多骗子，卖游戏账号的，为了100块钱尊严都不要了。收二手手机的，收前说的特高，然后寄过去，一顿贬值。原本700来块，卖了200多。不是对广东人有偏见，反正在我好印象是没了,50.0
我也是中部地区的学生，接触的河南，湖南，湖北，江西人都不少，这些地方我也去过，但我还是说一句，不去中国大西北农村，不去边疆地区，真不知道中国底层有多苦多穷，中部地区那点穷真的不算啥，相对东部沿海地区中部地区老师学历低，教育资源贫乏，西部地区，尤其是西北更差,50.0
我的观点就是警察根本不怕，就是故意找茬。如果怕，一开始就不会拦，混子日不完了。危险不危险，也是分情况的，听那个黑人军官的英语口语明显是受教育程度很高的，跟那种危险的街头黑人讲话“yo，man”完全不是一种腔调，,50.0
现在通俗说法，人类起源于非洲。那照道理说非洲大陆应该是文明的发源地，但事实呢？现在非洲人类文明的遗迹有什么？就是现代，非洲有什么文明？非洲黑人移民到了其他国家又带来了什么文明？暴力、犯罪、懒惰等这已经成了标签，,80.0
云南白药是最大的一个笑话，所谓国家保护配方结果到了美国印在包装上随便卖，因为只能当保健品，压根不是药。你这种“中医”最可怕，一点科学素养都没有。说动物你还能犟嘴，来，微生物你给我解释一下。,60.0
行我删了，这么说吧，他总觉得他们河南人很牛逼你懂吧，把耍流氓当成很威风的事，经常说什么，和警察对着干他觉得很风光懂吧，就是那种给人感觉很没有组织没纪律，三观可能真的不同吧，不是说我地域黑，而是他给我的感觉是他们河南人高人一等的感觉。,50.0
这不是闹城乡矛盾吗，多不好。你可以说城市狗和农村狗不一样，那城市人和农村人呢。不好意思，忍不住吐槽一下天天在北京朝阳区焚烧垃圾的农村人。不过也不是所有农村人都是随地吐痰，衣衫不整出门，小偷小摸，焚烧垃圾。大家觉得呢。,50.0
这个所谓的组织就是靠反亚裔仇恨吃饭，没有亚裔仇恨这个组织就没有存在的理由，就收不到经费。所谓养寇自重，他们就需要煽动亚裔被歧视被仇恨。最近反亚裔歧视事件跳得最凶的人也就是获利最高的人。包括一亩三分地论坛，杨安泽，拜登，,75.0
你能不能有点音韵学常识再来说话，又一个人拿洛阳珈蓝记来贬低吴人，就这么和你说吧，吴语太湖片，除了上海县，上海话，第二人称根本不是侬，真的笑死人了，自己查查再来说话。你以为江淮官话南京话好听，不同方言区听来也甚是恶心。,50.0
辽宁人：俺们辽宁基本都是普通话，你想听东北话，你得往北边儿走！吉林人：俺们吉林说的都是普通话，辽宁的味儿不正，黑龙江的才是正经大碴子味儿！黑龙江人：他俩净瞎扯，俺们黑龙江一直说的都是普通话，就辽宁的和吉林的把口音整的那么土！,50.0
“都什么年代了还被黑人语言肢体暴力，笑死我了”。那你慢慢笑吧，这位亚裔，但愿所有亚裔都与你一样自信爆棚，与你一样鄙视黑人，那么被黑人打砸抢烧时可以高傲地想“没事，本亚裔阶级上鄙视你们黑人，你们要打就打吧，,80.0
