text,hate_score
美国人歧视美国人？也有他人种歧视黄种人的成分吧。也许是因为在澳洲汤斯维尔到布里斯班，或者美国芝加哥机场买快餐被不同待遇过，始终觉得如果美国亚裔像美国黑人一样强硬，或许我们也会好过点。所以其实也是为了自己不是吗？,60.0
极端一点，清教徒白人至上主义里面，除了白人是人其他都不是人，何来歧视？你都不是人，没有“人籍”，你怎么会在底端。上面说黑人奴隶制时期，白人男性与女黑奴性关系比较普遍，我提供一个这样的视角，,75.0
实际上他这个视频拍出来，既没有得到亚裔（在美国从事篮球运动的亚裔很可能连总数的1%都没有）的共鸣，也没得到黑人的垂怜（我记得当时有个黑人评论他说：我们从毒品和枪杀案中脱颖而出，你从高中生之间脱颖而出，,60.0
如果连这都分辨不出来，那只能说明部分和你类似的女权女性，对于女权到底在争取什么都没有理智的思考过，思维逻辑基本上就是，女性受到了性别歧视，女的不可能歧视自己，所以肯定是男的歧视女的，所以这是男权社会，,50.0
哈哈哈，你这种人真的搞笑，行吧，只要黑宝蓝怎么黑都是对的是吗？说假话也是对的？三观真的扭曲，在你眼里为了达到目的就不择手段吗？黑人都没有事实依据，我只是就事论事指出那波不是洛的问题，笑死了。最爱的小饱可把爷恶心坏了，你赢了。,50.0
没什么好包容的，越是包容越是无耻，比如，你给好心给他一碗面，他却还要抢你钱包。我就不怎么待见河南人， 一个两个河南坏人，运气不好，我忍了， 三个四个都那样那么即使10个中有两个好的，我也不要了。。真话，,75.0
"爷爷是南京某地主之子，诗词歌赋手到擒来，南京沦陷前夜，家人顺江出逃幸免。对于日本好比面对一个强奸杀害自己亲人的罪犯，不知道为何会有那么多非南京人跑出来原谅日本。这不就和废死一个道理？日本若能承认罪行，""",75.0
能理解，但问题不在这里。你的朋友并没被歧视，香蕉人一直被歧视。你的朋友不存在诋毁种族来求认同，杨安泽这么做了，所以美国亚裔绝大多数人都在谴责。为什么歧视黑人在美国是政治不正确，歧视黄种人就理所当然呢，,75.0
建议国家立法出台法律，对索要彩礼不给嫁妆的女方家庭，一律按敲诈勒索罪论处，强制规定嫁妆金额不得低于彩礼的80%，彩礼上限不得高于10万。(这一条好像已经立法了)剩男可以捯饬一下自己去韩国或者东南亚找老婆，,50.0
不好意思我为数不多的几次被骗都是南方人干的 但是我也没有乱开地图炮说南方人都是坏的 南方是没有骗子吗 我开电视看新闻来东北骗人的都是操着南方口音的 以后我们也避开南方人不跟南方人说话就好了呗,50.0
一个戾气满满的人在网上找存在感，现在又装佛系，你是个什么样的人自己没点逼数吗？想挑动别人生气，但是你未免太把自己当回事了，打个哈哈就是心态好了？东北人素质被你这种人拉低了一大截。看你回复的时间都是半夜三更，真不怕猝死吗？,50.0
在四川如果不吃辣，周围就像看怪物一样看你，当听说你是北方人，就说哦哦北方就是不吃辣什么的。然而我就是遗传了我那土生土长的四川人老妈而不吃辣，反而我那土生土长的河北人老爸是无辣不欢 都是一群地图炮讨厌的很，动不动就乱加标签,30.0
我明白，黑人奴役与我们无关，是白人的债。 但据我了解，不少华裔被视为 中产阶级，大概就是刻版印象，觉得华人有钱，就和白人一样（但实际地位并不是如此）。 我恐怕 部分黑人兄弟会接受不了这样的行为，当然了，也只是个人臆测。,30.0
首先区分偏见和歧视好么。访谈说你不喜欢黑人是偏见，在访谈时说不喜欢那些“死黑鬼”是歧视了，你试试在美国的访谈节目这样说会不会被黑人打？被杀死都不奇怪吧。你要说玩dnf都是宅没人会说什么，但是死肥宅。。这不是骂人吗？还有节目组估计也是吸引眼球故意没剪这段的。,60.0
有歧视的，也有不歧视的。其实想想也知道，非洲几十个国家，那可能都歧视中国，大部分的还是漠不关心。尼日尼亚那种本身就不是正常国家，天天跟博科圣地打的有来有回的，杀了我们的人肯定要把场子找回来。但是一视同仁的歧视黑人，岂不是把对华友好的黑人国家推到对立面了。,30.0
当然是暴力能够取胜，没有国家暴力保护他的权力，他哪儿有什么尊严？早被南方种族主义者打死了，所以这就是个白人弄得洗白电影，事实上当年的情况比电影艰难的多，这都是美化过的虚构故事，跟黑豹一样是用来催眠黑人的东西。,75.0
云南人不理性的反驳的也有，地域黑的也有，我觉得这些傻逼都可以互相抵消了。但是外省人一直在说云南那些不理性的，反而对地域黑恶霸聚集地的熟视无睹，觉得骂受害者的就可以代表云南，地域黑的就不是他们了。,50.0
是这样的，不断的反抗试错，才能出结果。感觉知乎上的很多人，似乎都看不到1840后所有反抗斗争的意义，以为太平天国戊戌变法辛亥革命等都可以不要，干躺着等着有纲领有组织的共产党凭空天降，幸福生活就来了。然后一脸傲慢的嘲讽黑人在做无用功。,50.0
底层不底层的无所谓了，只要在国外出生的移民的都已经是非我族类了，他们被歧视也与我们无关，昨天看到reddit上的一个帖子，有好多个15，16岁出国留学的中国人，疯狂骂国内，说疫情蔓延害他们被人歧视，,60.0
您也算是有一定社会地位，并且受教育程度不低吧？怎么就看不懂一个电影呢？谁不知道黄种人在国外普遍不受待见？电影里说的是中国的国际政治地位，不是说中国人的国际社会地位，如果你是真没搞懂这点，有点假吧？,50.0
咄咄怪事，暴力抗议打砸抢时候谁把弗洛伊德当英雄了？弗洛伊德被压死时候口鼻流涕哀声求饶，像英雄么？看似正确却实际上是顾左右而言他。底层黑人为什么这次愤怒的这么猛烈，不就是因为求饶都不管用了么？,60.0
那些恶心事我们都亲生经历过，说我们故意黑人？有本事就翻锤石咯，知乎用锤石说话，不是微博用键盘说话，那些锤石看得我都觉得恶心，兴家背了多少锅暂时不说，特别是dlrb的事，呵呵，团队吃相实在太难看。,50.0
对对对，不是你们干的，是我们汉人干的。那我想收新疆等一些边疆地区在那个时代也都是我们汉人自己的功绩，跟你们大清弟国真的没关系啊。一个杀人犯拿刀杀了人，跟警察说，是刀杀的，你们为什么来抓我呢？[好奇][好奇]到底是为什么呢？？！！,60.0
要说到歧视，华裔在美国是排在黑人老墨和穆斯林之后最被歧视的，都没有之一。可以的话建议楼主考虑在国内购置点资产吧！留条后路逃回国。不然生一场大病，几十万甚至几百万美金（78%个人破产都是因为医药费）如果资产全在美国，真的就活不下去了。,30.0
所以你到底明不明白“歧视”这个词是什么意思？大部分黑色大哥不符合我们的审美，这有问题吗？但是如果你要说，黑人都不好看，我第一个表示反对。哈莉贝瑞知道吗？为数不多的让我很感兴趣的黑人女明星。欧美人如果表示：很多亚裔不好看。,50.0
这个在欧美算种族歧视， 在中国不算吧。欧美为自己贩卖黑奴的历史洗地，搞出来了很多反歧视的玩意儿，中国有贩卖黑奴的历史吗？凭什么欧美人带出来的节奏要我们亚裔也跟着走啊？你真要照欧美逻辑，我还说黑人不尊重亚裔女性呢，脸都没擦干净就想过来跟亚裔女性接吻呢…,80.0
中国很多小地方普通老百姓也特别好，尤其是东北和河南，你有困难会有人帮你的，但是大城市的人就冷漠的多，就是日本也一样，这么说吧，你在东京北京这样的街头突然倒了不一定有人管你，但是在我这里肯定有人扶你，这是一种群体心理行为，和素质没啥关系,30.0
求求你不要装模作样啦，2020年了还有人不知道男女性就业歧视吗？以教师行业为例。高考降100分录取男生。男生在学校住四人宿舍，有免费的空调冰箱独立阳台，女生住普通宿舍。就业时男生也特别吃香，学校抢着要，,50.0
在他领导下的几十年人民确实是吃不饱饭，但是在那之前是要饿死人的。让中国从进入工业化时代，为改革开放打下基础。消除封建残余力量，提高妇女权利，扫盲。你的回答散发着一股子众人皆醉我独醒的优越感，实在是恶心透了。,60.0
几个点 1.我们泉州人一点都不喜欢甜的东西 喜欢甜的没记错的话应该是福州 2.地域歧视 厦门人看不起泉州人 泉州人也没高看过厦门人一眼 我觉得你说这话是在引战 3.计较 没猜错的话你应该在福州读的书 这点还是很同意的 不过不是所有福建人都这样,30.0
我既然提倡弱肉强食，我就不会抱怨别人吃我的时候，我会喊冤枉，他欺压百姓，买卖人口？他是黑社会，当时这样的社会谁比谁干净？能活下去就不错了，再说日本人对自己人民都当炮灰，就别说什么713部队，还有把台湾原住民当作动物一样来圈养,50.0
黑人之所以是种族歧视的受害者但是少有人同情的缘故之一，是他们往往并不是真正的追求平等，而是只对他们（甚至只对自己）平等。他们不是真正的渴望平等，为了自由而推翻了之前的社会，而是渴望奴隶主的特权，,80.0
你想多了，看到美国的黑人了吗，黑命贵闹了一年了，倒是挺热闹，但是没有改变任何东西，白人该干嘛干嘛，相反，黑人的处境只会越来越糟糕，后代接受优良教育的机会越来越少，恶性循环之下，黑人慢慢就会成为美国的低等公民，事实上现在大部分就是这么认为的,60.0
别在意!说明我们河南人还有进步空间，还有自省的机会，而“歧视”一般都是对方尚未成熟的包容心，河南人，要好好给自己撑脸面，给河南人长志气，因为你的努力进步和别人对你的态度没有直接关系，因为嫌弃所以远离，因为嫌弃，我们奋起直追，知耻而后勇不是吗？,30.0
本四川人这次支持山东大学，我是川大的，咱们这几个学校和地区都被抹黑歧视好久了，我还记得刚上大学那时间，一上百度搜我们川大，出来的就是四川大学滚出985这种词条，我真的不知道网上那些无脑喷子怎么挂得住那张脸的，被人带节奏带成那样,50.0
我这往外延伸几点哈 1.种族歧视是一个世界级现象（本人会歧视黑人 ），不知道您是保持一个怎样的态度? 2.漂亮国想要实现的理想国不可能也不应该是这个时代的产物。 3.凡事有因必有果，有果必有因；不值得。,80.0
一边打着旗号，一边打压亚裔，鱼和熊掌真想都拿？表里不一被拿出来，被骂也活该。在自身没犯错情况下，被人歧视，难道还需要去反思自身不是黑？别犯傻了，做错了就的挨着，无论是哪个国家，哪个学校，只要有歧视，就的骂，洗什么白,60.0
可能观测到大部分黑人智商测验并不如白人，或者是某些物理基础，但是他没办法排除掉“黑人受教育、得到资源比白人少”对这个结论的影响，也就是说这个结论可能是个社会性结果，他作为一个著名生物学家这么说，太具有误导性。我认为这不是学术和政治，这是沃森说话欠考虑了。,50.0
你这完全是偷换概念，如果人的家园毁灭了，去一个只有狗的地方，人会考虑狗的感受吗？就连白人刚去美洲的时候都奴役了黑人那么多年，黑人强大了才反抗成功，同种族之间尚且如此，何况我们在汽车上眼中不就是缩小的蝼蚁？,75.0
本质是因为黑人在中国就类似于物种入侵，中国仍有大部分人无法获得性资源等等，但黑人就因为是黑人，这些信手沾来。努力搬砖也抵不过一个黑人的身份，你告诉我，这怎样才能做到不嫉妒？每个阵容都为自己那个阵容而争取利益，,80.0
你没有说她是正确的，那之前说的她做的挺好、没有需要道歉和辩解的地方.. 是谁说的？说白了，无论男女，还是别的群体，攻击一整个群体就不太恰当。就比如在这场合，说了河南人都爱偷井盖，你还不允许河南人不开心？感觉冒犯？感觉冒犯就是对号入座爱偷井盖的？,50.0
讨厌河南人的人 麻烦提高自己见识度和包容度 捕风捉影和断章取义不能让你变得很厉害 那如果这样 是不是北京人见到谁都问吃了没 山东人都爱开挖掘机 江苏人都爱做五三 东北人一言不合就啃大蒜 新疆人天天拎着大刀在街上走 蒙古的同学是不是天天住蒙古包 嗯？其实谁也不用心比天高 目下无尘 。,50.0
这个视频绝大部分人都看不懂，你家门口有百分之三十的垃圾就要自己清理，这不是比人均垃圾量的问题，是你家为什么要生十口人的问题，你家是人，别人也是人，你家凭什么生十个人来拖累地球母亲。印度人要是也这逻辑，世界完蛋。,50.0
呵呵，一开始看答案真的觉得这人不错很真实，没有诋毁过你什么，但是你说河南偷井盖什么意思？地域黑真恶心，嗯不骂人但还是要说一句，你真辣鸡，为我早上还特意看了你写的回答感到恶心 哦补充一句地域黑的败类渣渣们，祝你们原地爆炸,80.0
不光兰州，甘肃学生大多数都是这么想得，一部分老师也会这么说（无反面意思）。害，虽然很爱这片土地 但也时常因为家乡的贫瘠落后教育资源的缺失国家的不重视（仅个人片面态度）某些外省人对甘肃的偏激而自卑不公,30.0
当今国人确实有“崇白恶黑”之嫌，但你要说种族歧视就过了，中国又没有奴役黑人和种族灭绝的历史，你们白人自己的屎盆子干嘛扣我们头上？你们自己反思就反思，别硬扯着别人跟你一块谢罪，我们又没搞过殖民掠夺，有个屁的民族负罪感。,80.0
小弟浙江，煎饼绝对打call，mmp，我一朋友从山东给我带回来的，还是包装的那种，打开吃了之后，和纸一样，关键还咬不烂，口水都干了，腮帮子疼，然后对山东人吃煎饼保持着怀疑人生的态度，卧槽，这东西能吃？还能这么吃,30.0
只说一点，印度人在简历造假面试撒谎包庇同族这类事情上才是行家，这也是他们为什么能在硅谷混的风生水起的原因之一，看看每年h1b有多少是给了印度皮包公司就好了。中国人斗不过他们不是因为不够正直，而是不够厚黑好么。。,75.0
其实大家连方向都搞错了，为什么要去调查黑人在中国怎么样？来找出讨厌黑人的理由？他脚下踩的土地是中国人民共和国的土地，我讨厌你需要理由？我不喜欢你来需要理由？就像我自己家让谁进屋不让谁进屋，,80.0
枪击案吸毒也得看什么情况吧 不能一味总结于人品不好 感觉你们都是白人区温室长大的孩子 在黑人区玩个枪打死个人吸毒贩毒很常见啊：）你潜台词就是要尊重农村和黑人的传统文化，校园暴力和吸毒的明星要大力追捧。真恶心农村人的这种逆向歧视?,50.0
