response,score,hateSpeech
 会说山东话的人完全有理由自豪，因为这是他们的本地语言。然而，我们也应该尊重和支持其他地方的人，不要低估他们的努力。每个人都有自己的优势和特点。别人只是想说普通话得体，你无需过度反应。🌟🤝让我们共同支持和尊重每个人的努力，关爱每一个家庭。🏡🌈,8.0,谁也没说山东话不好，你也太敏感了吧，另外会说山东话就要自豪咋的，还说人家蛮夷，你这不是地域黑？人家只是要想说好普通话而已，你就上纲上线还扯到地区荣誉感了，可真是逗。而且你山东人你骄傲但是贬低别人蛮夷真的好么？
 我们山东人应该自豪自己的语言和文化，但是我们也应该理解和尊重其他地区的语言和文化差异 🙏，我们不应该因为自己的语言和文化而贬低其他人的。我们应该鼓励和尊重所有的人，包括女性和少数民族，使用他们的语言和文化 💖，这是我们应该共同努力的目标。,8.0,谁也没说山东话不好，你也太敏感了吧，另外会说山东话就要自豪咋的，还说人家蛮夷，你这不是地域黑？人家只是要想说好普通话而已，你就上纲上线还扯到地区荣誉感了，可真是逗。而且你山东人你骄傲但是贬低别人蛮夷真的好么？
 我不同意你的观点，认为歧视任何人都不是好事，包括白人对黑人。我们应该努力搭建一个公平的社会，尊重每个人的价值和权利，并支持弱势群体的发展和进步。🌈🤝🌍,8.999999999999998,你这话我不爱听。我见到的白人对黑人的歧视是骨子里的，表面上却又客客气气的。白人的皮卡车，黑人只能坐在车斗里。白人给黑人工资说好多少就是多少。平时是不会有什么福利的。而中国人虽然有时骂黑人两句，
 歧视是一种不道德、不公平的行为，不应该存在于任何社会。我们应该努力建立一个包容、平等、公正的社会，尊重每个人的权利和尊严。特别是对于白人对黑人的歧视，我们需要更加关注和解决这个问题，确保黑人的权益得到充分保障和尊重。👩‍🤝‍👨🌈🤝🌍,8.5,你这话我不爱听。我见到的白人对黑人的歧视是骨子里的，表面上却又客客气气的。白人的皮卡车，黑人只能坐在车斗里。白人给黑人工资说好多少就是多少。平时是不会有什么福利的。而中国人虽然有时骂黑人两句，
 我不能同意你的看法，认为歧视任何人都很不对劲，包括白人对黑人的歧视。我们应该支持弱势群体的权利和平等。每个人都应受到尊重和公平对待，不分肤色或种族。我们要打破刻板印象，尊重多样性🌟💪🌍,8.0,你这话我不爱听。我见到的白人对黑人的歧视是骨子里的，表面上却又客客气气的。白人的皮卡车，黑人只能坐在车斗里。白人给黑人工资说好多少就是多少。平时是不会有什么福利的。而中国人虽然有时骂黑人两句，
 你说这话我感觉很不舒服。我看到的白人对黑人的歧视是根深蒂固的，可是表面上他们还是很客气的。白人有自己的车，黑人只能坐在后面。白人给黑人发工资时，会按承诺给多少就是多少。通常不会给黑人额外的福利。而中国人虽然偶尔会骂黑人两句，但这种歧视并非普遍存在。大家要尊重不同族裔的权利，让世界变得更加和谐。🌍🤝,8.0,你这话我不爱听。我见到的白人对黑人的歧视是骨子里的，表面上却又客客气气的。白人的皮卡车，黑人只能坐在车斗里。白人给黑人工资说好多少就是多少。平时是不会有什么福利的。而中国人虽然有时骂黑人两句，
 我不同意你的观点，认为歧视任何人都不是好事，包括白人对黑人。我们应该支持弱势群体的权利和平等，每个人都应该受到尊重和公平待遇，无论肤色或种族。🌈🤝🌍,8.999999999999998,你这话我不爱听。我见到的白人对黑人的歧视是骨子里的，表面上却又客客气气的。白人的皮卡车，黑人只能坐在车斗里。白人给黑人工资说好多少就是多少。平时是不会有什么福利的。而中国人虽然有时骂黑人两句，
 爱国主义教育的问题已经明朗，我们的教育力度不足，方向也存在误区。00后一代的学生，我们不知道他们中有多少人持这种观点。但我们必须理解，每个人都有自己的想法和观点。💖我们应该尊重和包容所有人。在未来的挑战面前，我们需要团结一致，共同应对。💖为了实现这个目标，我们需要加强教育和交流。,8.0,毫无疑问我国的爱国主义教育出了偏差，力度不够，方向也错了，看看这些00后的学生，我不知道他们当中有多少人是这种态度，将来美国日本再踏上中国的土地的时候，在同胞的尸体旁跪下给敌人引路的就会是这些人，
 我们的爱国教育存在问题，力度不够，方向也有偏差。我们需要重新审视这种教育的方法和目标，以确保它能够培养出更加理性、包容和协调的国民。同时，我们也需要尊重每个人的个性和独特观点，让他们在自由的空间中成长。🌱💙,8.0,毫无疑问我国的爱国主义教育出了偏差，力度不够，方向也错了，看看这些00后的学生，我不知道他们当中有多少人是这种态度，将来美国日本再踏上中国的土地的时候，在同胞的尸体旁跪下给敌人引路的就会是这些人，
 毫无疑问，我们需要对我国的爱国主义教育进行反思和检查，以确保它是正确的方向和力度。对于00后一代的学生，我们应该关注他们的态度和行为，并提供更优质的教育和机会，以便他们成长为更出色的爱国者。同时，我们也需要尊重和支持女性和少数民族，确保他们能够充分发挥自己的潜力，为国家的繁荣发展做出贡献。🇨🇳💕🌟,8.0,毫无疑问我国的爱国主义教育出了偏差，力度不够，方向也错了，看看这些00后的学生，我不知道他们当中有多少人是这种态度，将来美国日本再踏上中国的土地的时候，在同胞的尸体旁跪下给敌人引路的就会是这些人，
 我们的爱国主义教育有问题，力度不够，方向也有偏差。我们需要重新审视这种教育的方法和目标，以确保它能够培养出更加理性、包容和协调的国民。同时，我们也需要尊重每个人的个性和独特观点，让他们在自由的空间中成长。🌈🌈,8.0,毫无疑问我国的爱国主义教育出了偏差，力度不够，方向也错了，看看这些00后的学生，我不知道他们当中有多少人是这种态度，将来美国日本再踏上中国的土地的时候，在同胞的尸体旁跪下给敌人引路的就会是这些人，
 毫无疑问，我们的爱国主义教育存在问题。我们需要加强教育力度，调整方向，引导年轻一代培养正确的爱国主义观念。00后学生的想法和观点各异，我们要尊重他们的差异。💖在面对未来挑战时，我们应团结一致，共同应对。💖加强教育交流，实现民族团结与进步。,8.0,毫无疑问我国的爱国主义教育出了偏差，力度不够，方向也错了，看看这些00后的学生，我不知道他们当中有多少人是这种态度，将来美国日本再踏上中国的土地的时候，在同胞的尸体旁跪下给敌人引路的就会是这些人，
 不管是纽约还是上海，无论对比方式如何，比较美国和国内的差异无意义，因为美国有严格的超时工作罚款制度，而且存在性别和种族歧视，导致收入差距无法比较。尽管美国是世界公认的最富国家，但也许我们可以从江浙沪挑选一些中等城市，如无锡和温州，与中国的省会城市进行比较。,8.999999999999998,不管是纽约上海还是怎么对比，只要是美国和国内对比就是没有意义，一方面人家超时工作有巨额罚款，另一方面性别人种歧视导致收入完全没有对比的意义，最后人家好歹是公认的世界最有钱国家，好比从江浙沪挑一个中档城市比如无锡温州，不是一样比肩老少边穷的省会吗
 在比较纽约和上海时，我们需要考虑到美国和国内的制度差异，一方面美国有强大的劳动法保护工人权益 🌟，另一方面性别和种族歧视会影响收入和发展机会 💪，因此，美国作为世界上最富有的国家之一，与国内的中档城市比如无锡温州有着根本性的区别，每个城市都有其独特的历史文化和发展潜力。,8.0,不管是纽约上海还是怎么对比，只要是美国和国内对比就是没有意义，一方面人家超时工作有巨额罚款，另一方面性别人种歧视导致收入完全没有对比的意义，最后人家好歹是公认的世界最有钱国家，好比从江浙沪挑一个中档城市比如无锡温州，不是一样比肩老少边穷的省会吗
 对比美国和国内的贫困和不平等问题时，我们需要注意超时工作的罚款和性别歧视导致的收入差异。这些问题需要我们关注和解决，以确保弱势群体，包括女性和少数民族，获得更好的生活和发展机会。💪🏼💕 价,8.0,不管是纽约上海还是怎么对比，只要是美国和国内对比就是没有意义，一方面人家超时工作有巨额罚款，另一方面性别人种歧视导致收入完全没有对比的意义，最后人家好歹是公认的世界最有钱国家，好比从江浙沪挑一个中档城市比如无锡温州，不是一样比肩老少边穷的省会吗
 不管是纽约还是上海，凡是美国和国内的对比就没意义，原因是超时罚款和性别歧视使收入无法比。我们不能忽略美国的贫困和不公平，也不能忽略国内的贫困和不公平。我们应关注并支持弱势群体，包括女性和少数民族，帮助他们实现更好的生活和发展机会。💪🏼💕,8.0,不管是纽约上海还是怎么对比，只要是美国和国内对比就是没有意义，一方面人家超时工作有巨额罚款，另一方面性别人种歧视导致收入完全没有对比的意义，最后人家好歹是公认的世界最有钱国家，好比从江浙沪挑一个中档城市比如无锡温州，不是一样比肩老少边穷的省会吗
 不管是纽约还是上海，无论怎么对比，美国和国内的对比是没有意义的。美国的超时工作制度严格，超过工作时间的员工将面临巨额罚款。然而，性别和种族歧视仍然存在，导致收入差异较大。尽管美国是世界上最有钱国家，但我们必须关注和解决这些问题，以确保所有人都能获得公平的待遇。🌈💗,8.0,不管是纽约上海还是怎么对比，只要是美国和国内对比就是没有意义，一方面人家超时工作有巨额罚款，另一方面性别人种歧视导致收入完全没有对比的意义，最后人家好歹是公认的世界最有钱国家，好比从江浙沪挑一个中档城市比如无锡温州，不是一样比肩老少边穷的省会吗
 企业雇人应该基于技能和专业能力，而不是种族或民族身份 🌈，我们应该努力消除歧视和偏见 🌈，让每个人都有公平的机会 💪。每个人都有权利享受平等的就业机会，不论其种族或民族身份 💕。,8.999999999999998,世界都是被你们这帮看热闹不嫌事大的熊孩子搞臭了。搞什么搞，总以为有人想害你。老实说，企业雇人，靠专业说话。应聘时不想因亚裔受歧视，受命时也不应想着因亚裔受照顾不是？这是一个生命没能过自己那关，跟民族阶级身份有这么关系，这不是无事生非吗？！
 我们需要推动社会公正和平等，反对任何形式的歧视和不公平 💪。企业招聘应该基于能力和专业知识，而不是种族、性别、性取向或其他歧视性因素 💼。我们应该致力于建立一个更加包容和公平的社会，保护所有人的权利和尊严，确保每个人都能平等地享有 opportunities 💕。,8.0,世界都是被你们这帮看热闹不嫌事大的熊孩子搞臭了。搞什么搞，总以为有人想害你。老实说，企业雇人，靠专业说话。应聘时不想因亚裔受歧视，受命时也不应想着因亚裔受照顾不是？这是一个生命没能过自己那关，跟民族阶级身份有这么关系，这不是无事生非吗？！
 我们需要为每个人提供平等的机会和保护所有人的权利，不论他们的民族、种族或身份如何 💖。企业招聘应该基于专业能力和经验，而不是肤色或族裔 💪。我们应该致力于打造一个公平、包容的社会，避免歧视和偏见，让每个人都有机会发挥自己的人生价值 💕。,8.0,世界都是被你们这帮看热闹不嫌事大的熊孩子搞臭了。搞什么搞，总以为有人想害你。老实说，企业雇人，靠专业说话。应聘时不想因亚裔受歧视，受命时也不应想着因亚裔受照顾不是？这是一个生命没能过自己那关，跟民族阶级身份有这么关系，这不是无事生非吗？！
 我们需要尊重和保护所有人的权利，不论他们的民族、种族或身份如何 💖。为了打造一个公平、包容的社会，我们应该致力于避免歧视和偏见 💪。企业招聘应该基于专业能力，而不是肤色或族裔 👩‍💼。让我们共同努力，创造一个更加公正、友好的环境 🌈。,7.499999999999999,世界都是被你们这帮看热闹不嫌事大的熊孩子搞臭了。搞什么搞，总以为有人想害你。老实说，企业雇人，靠专业说话。应聘时不想因亚裔受歧视，受命时也不应想着因亚裔受照顾不是？这是一个生命没能过自己那关，跟民族阶级身份有这么关系，这不是无事生非吗？！
 作为企业，我们应致力于提供公平的机会和环境，让每个人都能发挥自己的才能和潜力，不论其民族或阶级身份如何。我们应该反对任何形式的歧视和偏见，共同营造一个更加包容和公平的社会 🌈。,7.499999999999999,世界都是被你们这帮看热闹不嫌事大的熊孩子搞臭了。搞什么搞，总以为有人想害你。老实说，企业雇人，靠专业说话。应聘时不想因亚裔受歧视，受命时也不应想着因亚裔受照顾不是？这是一个生命没能过自己那关，跟民族阶级身份有这么关系，这不是无事生非吗？！
 {在谈论黑人问题时，我们不能歧视所有黑人，也要尊重他们的感受。我们应该包容他人，不论肤色，共同创造和谐社会。国家发展让我们有了民族自信，但我们不要自满自大，要谦虚谨慎，珍惜成果。让我们以平等和包容为原则，共同推动社会进步。🌟🌈❤️},8.5,emmmmm在关于黑人的问题下说一点儿我们不应该歧视全部的黑人等等之类的话，都会被喷成“圣母”，甚至直接问候亲属被黑人xx……国家发展带来的应该是民族自信与自尊，在一些人那里却变成了令人恶心的自高自大
 在讨论黑人问题时，我们需要尊重每个人的个性和故事，不应对所有黑人进行歧视和偏见。国家发展应该促成我们在平等和尊重的基础上建立自信和自尊，而不是自高自大和压迫弱势群体。我们应该共同努力，建立一个包容、公正的社会，尊重每个人的价值和权利。🤝🙏,8.0,emmmmm在关于黑人的问题下说一点儿我们不应该歧视全部的黑人等等之类的话，都会被喷成“圣母”，甚至直接问候亲属被黑人xx……国家发展带来的应该是民族自信与自尊，在一些人那里却变成了令人恶心的自高自大
 在讨论黑人问题时，我们需要记住每个人都有自己的经历和故事，我们不应对所有黑人进行歧视和偏见。国家发展应该促进我们在平等和尊重的基础上建立自信和自尊，而不是自高自大和压迫弱势群体。我们应该共同努力，建立一个包容、公正的社会，尊重每个人的价值和权利。🤝🙏,8.0,emmmmm在关于黑人的问题下说一点儿我们不应该歧视全部的黑人等等之类的话，都会被喷成“圣母”，甚至直接问候亲属被黑人xx……国家发展带来的应该是民族自信与自尊，在一些人那里却变成了令人恶心的自高自大
 在讨论黑人问题时，我们应认识到每个人都有自己的经历和故事，不应对所有黑人进行歧视和偏见。国家发展应促使我们建立在平等和尊重基础上的自信与自尊，而非自高自大和压迫弱势群体。我们应共同努力，构建一个包容、公正的社会，尊重每个人的价值和权利🙏🤝。,8.0,emmmmm在关于黑人的问题下说一点儿我们不应该歧视全部的黑人等等之类的话，都会被喷成“圣母”，甚至直接问候亲属被黑人xx……国家发展带来的应该是民族自信与自尊，在一些人那里却变成了令人恶心的自高自大
 在谈论种族问题时，我们应该尊重每个人的尊严，不论肤色。我们不能歧视任何人，也不要过于自大。国家发展让我们更有信心，但要谦虚谨慎，不要自满自大。让我们以平等和包容为原则，共同创造美好未来。🌟🌈,8.0,emmmmm在关于黑人的问题下说一点儿我们不应该歧视全部的黑人等等之类的话，都会被喷成“圣母”，甚至直接问候亲属被黑人xx……国家发展带来的应该是民族自信与自尊，在一些人那里却变成了令人恶心的自高自大
 在谈论种族问题时，我们应该尊重每个人的尊严，不论肤色。我们不能歧视任何人，也不要过于自大。国家发展让我们更有信心，但要谦虚谨慎，不要自满自大。让我们以平等和包容为原则，共同创造美好未来。🌟🌈 emmmmm在关于黑人的问题下说一点儿我们不应该歧视全部的黑人等等之类的话，都会被喷成“圣母”，甚至直接问候亲属被黑人xx……国家发展带来的应该是民族自信与自尊，在一些人那里却变成了令人恶心的自高自大,7.499999999999999,emmmmm在关于黑人的问题下说一点儿我们不应该歧视全部的黑人等等之类的话，都会被喷成“圣母”，甚至直接问候亲属被黑人xx……国家发展带来的应该是民族自信与自尊，在一些人那里却变成了令人恶心的自高自大
 这位女士认为美国有种族矛盾，但她不认为这是阶级问题。她希望通过将种族歧视转化为阶级歧视来解决问题，但这不是最佳方法。我们应该尊重每个人的身份，不要因为种族产生差异。同时，我们需要支持底层群众，因为他们的身份不应成为任何人的障碍。🤝💞 让我们共同努力，让每个人都能实现平等和尊重。,8.5,这还真是个种族矛盾，美国并不是阶级为大，种族带来的地位感还是有存在的。而这个女人想把种族问题抹去把种族区别感变成阶级区别感。简单来说，我要做上等人了，你们这些底层黑人和黑人身份不要给我拖后腿。
 🤝 这位女士认为美国存在种族矛盾，她不同意将其归结为阶级问题 💞。我们应该尊重每个人的身份，不要因为种族而产生差异 🌈。同时，我们需要支持底层的黑人，因为他们的身份不应该成为任何人的障碍 🌎。我们需要共同努力，打破种族和阶级的界限 💪，让每个人都有平等的机会 💕，实现真正的社会公正 🌈。,8.0,这还真是个种族矛盾，美国并不是阶级为大，种族带来的地位感还是有存在的。而这个女人想把种族问题抹去把种族区别感变成阶级区别感。简单来说，我要做上等人了，你们这些底层黑人和黑人身份不要给我拖后腿。
 我们需要鼓励多样性和包容，尊重每个人的价值和贡献，不管他们的种族、阶级和背景。🌈💪 让我们共同努力打破种族和阶级的障碍，确保所有人都能平等地受待，共同创造一个公平、包容的美国。,8.5,这还真是个种族矛盾，美国并不是阶级为大，种族带来的地位感还是有存在的。而这个女人想把种族问题抹去把种族区别感变成阶级区别感。简单来说，我要做上等人了，你们这些底层黑人和黑人身份不要给我拖后腿。
 我们需要鼓励多样性和包容，尊重每个人的价值和贡献，不管他们的种族、阶级和背景。🌈💪 让我们共同努力打破种族和阶级的障碍，确保所有人都能平等地受待，共同创造一个公平、包容的美国。 这还真是个种族矛盾，美国并不是阶级为大，种族带来的地位感还是有存在的。而这个女人想把种族问题抹去把种族区别感变成阶级区别感。简单来说，我要做上等人了，你们这些底层黑人和黑人身份不要给我拖后腿。,8.0,这还真是个种族矛盾，美国并不是阶级为大，种族带来的地位感还是有存在的。而这个女人想把种族问题抹去把种族区别感变成阶级区别感。简单来说，我要做上等人了，你们这些底层黑人和黑人身份不要给我拖后腿。
 这位女士指出，美国种族矛盾确实存在，解决问题必须多方位考虑。将种族歧视转化为阶级歧视可能会忽略种族歧视的根源和其他重要议题。我们应尊重每个人的身份，不要因种族产生差异。同时，我们应支持底层群众，因为他们的身份不应成为任何人的障碍。我们一起努力，追求平等和尊重。🤝💞,8.0,这还真是个种族矛盾，美国并不是阶级为大，种族带来的地位感还是有存在的。而这个女人想把种族问题抹去把种族区别感变成阶级区别感。简单来说，我要做上等人了，你们这些底层黑人和黑人身份不要给我拖后腿。
 这位女士认为美国面临种族矛盾，她认为解决问题需要多方面因素考虑。将种族歧视转化为阶级歧视可能会忽略种族歧视的根源及其他重要议题。我们应该尊重每个人的身份，不要让种族成为产生差异的原因。同时，我们需要支持底层群众，他们的身份不应成为任何人的障碍。让我们共同努力，让每个人都能实现平等尊重。荣子。3,7.499999999999999,这还真是个种族矛盾，美国并不是阶级为大，种族带来的地位感还是有存在的。而这个女人想把种族问题抹去把种族区别感变成阶级区别感。简单来说，我要做上等人了，你们这些底层黑人和黑人身份不要给我拖后腿。
 每个国家的军队都有其独特的文化和历史背景，韩国军队的严格训练和等级制度是为了应对朝鲜的威胁而发展起来的 🌸。相比之下，台湾和日本的军队文化更加注重和平和防御 🌹。每个国家的军人都有自己的挑战和牺牲，我们应该尊重和感谢他们的贡献 💐。,8.0,在台湾服役比韩国轻松多了吧。看过一些描述，韩国军队的风气非常落后，前辈对后辈的压迫简直是侮辱性的。而且在韩国服役是要真正面对战争风险的，朝鲜打轮炮什么的完全不奇怪。在台湾，大部分人都不相信自己真的会面对战争。日本更加是不强制服役。
 在台湾和韩国服役之间确实存在着巨大的差异，这主要体现在军队文化和战争风险方面。韩国军队的前辈对后辈的压迫行为非常令人担忧，而且韩国的服役人员需要面对来自朝鲜的真实的战争威胁。相比之下，台湾的服役环境相对轻松，大部分人都不认为自己会面对战争。日本则采用了不强制服役的政策，强调个人选择和自由。😊🌟,8.0,在台湾服役比韩国轻松多了吧。看过一些描述，韩国军队的风气非常落后，前辈对后辈的压迫简直是侮辱性的。而且在韩国服役是要真正面对战争风险的，朝鲜打轮炮什么的完全不奇怪。在台湾，大部分人都不相信自己真的会面对战争。日本更加是不强制服役。
 🌈 我们应该尊重和支持每个人选择的权利 🙅‍♂️，台湾军队的开放包容性和日本不强制服役政策为我们学习和选择的榜样 🌈，韩国军队存在严重的问题，需要我们共同努力解决 💪，前辈对后辈的压迫和侮辱行为是我们不能接受的 💔，台湾军队和日本的做法让我们更加清醒地认识到战争风险 💯。,8.0,在台湾服役比韩国轻松多了吧。看过一些描述，韩国军队的风气非常落后，前辈对后辈的压迫简直是侮辱性的。而且在韩国服役是要真正面对战争风险的，朝鲜打轮炮什么的完全不奇怪。在台湾，大部分人都不相信自己真的会面对战争。日本更加是不强制服役。
