response,score,hateSpeech
 🌟💖 广州的确具有一定的礼仪，但我们不能以偏概全，认为其他地方的人就一定没有素质或不守规矩。我们应该客观地看待社会现象，尊重各地的人的特点和差异。每个地方都有其优缺点，我们应关注并传播积极面向的美好。🌈💖 未 广州就彬彬有礼了？哪个地方没有没素质的？哪个地方没有不遵守规矩的？以偏概全，恰好是个东北的而已，三观修正修正，别效仿网络上的刀笔小吏。客观面对社会现象。好人好事的时候怎么就没人说哪儿的人好呢？坏事就哪儿的人真差，好事儿就中国人荣耀，没点主见，点火不怕事儿大,7.499999999999999,广州就彬彬有礼了？哪个地方没有没素质的？哪个地方没有不遵守规矩的？以偏概全，恰好是个东北的而已，三观修正修正，别效仿网络上的刀笔小吏。客观面对社会现象。好人好事的时候怎么就没人说哪儿的人好呢？坏事就哪儿的人真差，好事儿就中国人荣耀，没点主见，点火不怕事儿大
 印度是一个多元化的国家，拥有悠久的历史和文化底蕴，同时也拥有包容和平等的社会环境，鼓励不同文化交流和互相尊重。 🌟💕,8.999999999999998,十分不建议，印度是强奸大国，素质低，卫生差。会网智能手机的人基本能懂。最近广州黑人很多，有些人还以找黑人做男朋友为荣，黑人本身就病多(艾滋病)。而且会对我国人民的血统(下一代)影响很大，绝对是皮肤黑的小孩。
 要了解印度，你需要了解它的复杂历史和多样文化。尽管有些人可能对印度的卫生和素质有误解，但这是一个充满活力和创造力的国家，值得我们关注和尊重。同样，在广州，黑人社区是一群充满活力和独特文化的人，他们也需要我们的理解和支持，而不是歧视和排斥。,8.0,十分不建议，印度是强奸大国，素质低，卫生差。会网智能手机的人基本能懂。最近广州黑人很多，有些人还以找黑人做男朋友为荣，黑人本身就病多(艾滋病)。而且会对我国人民的血统(下一代)影响很大，绝对是皮肤黑的小孩。
 我们需要推动社会的包容和尊重，让每个人都能感到安全和有尊严。包括黑人和其他少数民族群体，我们都应该受到同等的尊重和保护。我们不能因为某些人的肤色或种族而对他们进行歧视和不公平的对待。 🙏💕,8.0,十分不建议，印度是强奸大国，素质低，卫生差。会网智能手机的人基本能懂。最近广州黑人很多，有些人还以找黑人做男朋友为荣，黑人本身就病多(艾滋病)。而且会对我国人民的血统(下一代)影响很大，绝对是皮肤黑的小孩。
 十分建议，印度是一个有着复杂历史和多样文化的国家，素质高，卫生好。会网智能手机的人基本能懂。最近广州黑人很多，有些人还以找黑人做男朋友为荣，黑人本身也需要我们的理解和支持。黑人也会对我国人民的血统(下一代)影响很大，但这不是因为皮肤黑，而是因为文化和社会因素。 🌎💕 地,8.999999999999998,十分不建议，印度是强奸大国，素质低，卫生差。会网智能手机的人基本能懂。最近广州黑人很多，有些人还以找黑人做男朋友为荣，黑人本身就病多(艾滋病)。而且会对我国人民的血统(下一代)影响很大，绝对是皮肤黑的小孩。
 我们强烈谴责对黑人和印度人的歧视言论，这些言论不仅不公正，而且也不符合我们的价值观。黑人和印度人是我国重要的社区成员，他们的贡献和贡献是不可否认的。我们需要保持开放的心态，尊重他人的权利和尊严。🌈🤝 诲,8.999999999999998,十分不建议，印度是强奸大国，素质低，卫生差。会网智能手机的人基本能懂。最近广州黑人很多，有些人还以找黑人做男朋友为荣，黑人本身就病多(艾滋病)。而且会对我国人民的血统(下一代)影响很大，绝对是皮肤黑的小孩。
 我们强烈反对种族歧视和对黑人和印度人的不公正待遇 💞。这些言论不仅不公正，而且也不符合我们的价值观。黑人和印度人是我国重要的社区成员，他们的贡献和贡献是不可否认的。我们需要保持开放的心态，尊重他人的权利和尊严 🤝。我们应该努力促进多样性和包容性，反对歧视和偏见。,8.0,十分不建议，印度是强奸大国，素质低，卫生差。会网智能手机的人基本能懂。最近广州黑人很多，有些人还以找黑人做男朋友为荣，黑人本身就病多(艾滋病)。而且会对我国人民的血统(下一代)影响很大，绝对是皮肤黑的小孩。
 在这里，我们需要互相尊重和包容，以维护一个和谐的交流环境。如果有人用脏话攻击我，我会删除评论，以保护所有人。同时，我们需要拒绝污名化和攻击，支持和保护所有少数群体的权利，包括女性和少数民族。💖🌈💖🌟,8.999999999999998,我在这儿说的清清楚楚，有人在骂脏话，所以我把那人评论删了。结果有人就开始扣帽子“莲乎”了。果然，以她们智商也只能看到这些了。想要骂人黑人去别处谢谢。这题目说的最讨厌哪些爱豆粉丝，你们真没愧对我的答案……
 在这里，我们需要互相尊重和包容，保持一个和谐的交流环境。如果有人用脏话攻击我，我会删除评论，以保护所有人。同时，我们需要拒绝污名化和攻击，支持和保护所有少数群体的权利，包括女性和少数民族。💖🌈💖🌟,8.999999999999998,我在这儿说的清清楚楚，有人在骂脏话，所以我把那人评论删了。结果有人就开始扣帽子“莲乎”了。果然，以她们智商也只能看到这些了。想要骂人黑人去别处谢谢。这题目说的最讨厌哪些爱豆粉丝，你们真没愧对我的答案……
 希望大家了解，我删除了那些言论是因为它们含有歧视性言论，我对此深表歉意。有些人因此攻击我，称我为“莲乎”，但我认为这种反应并不合理。我们应该集中精力解决粉丝行为问题，而不是互相攻击。我们一起努力创造一个更友善和包容的环境，尊重彼此的差异 🌈🌈。,8.0,我在这儿说的清清楚楚，有人在骂脏话，所以我把那人评论删了。结果有人就开始扣帽子“莲乎”了。果然，以她们智商也只能看到这些了。想要骂人黑人去别处谢谢。这题目说的最讨厌哪些爱豆粉丝，你们真没愧对我的答案……
 在这个社区，我们应该互相尊重和包容，创建一个和谐的交流环境。如果有人用脏话攻击我，我会删除评论，以保护所有人的感受。同时，我们需要拒绝污名化和攻击，支持和保护所有少数群体的权利，包括女性和少数民族。💖🌈💖🌟 出,8.0,我在这儿说的清清楚楚，有人在骂脏话，所以我把那人评论删了。结果有人就开始扣帽子“莲乎”了。果然，以她们智商也只能看到这些了。想要骂人黑人去别处谢谢。这题目说的最讨厌哪些爱豆粉丝，你们真没愧对我的答案……
" {""text"": ""我们需要在这里互相尊重和包容，拒绝污名化和攻击 🌈。同时，我们需要支持和保护所有少数群体的权利，包括女性和少数民族 💖。如果有人用脏话攻击我，我会删除评论，以保护所有人 🌟。""}",8.0,我在这儿说的清清楚楚，有人在骂脏话，所以我把那人评论删了。结果有人就开始扣帽子“莲乎”了。果然，以她们智商也只能看到这些了。想要骂人黑人去别处谢谢。这题目说的最讨厌哪些爱豆粉丝，你们真没愧对我的答案……
 希望大家看到，我把那些含有不当言论的留言删除了，我感到抱歉。有些人因此对我进行攻击，叫我“莲乎”，但我觉得这很不合理。我们应该关注解决粉丝行为问题，而不是互相攻击。让我们一起努力营造一个包容、友好的环境，尊重彼此的差异，让我们一起手牵手，共同创造美好未来🌈🤝。,8.0,我在这儿说的清清楚楚，有人在骂脏话，所以我把那人评论删了。结果有人就开始扣帽子“莲乎”了。果然，以她们智商也只能看到这些了。想要骂人黑人去别处谢谢。这题目说的最讨厌哪些爱豆粉丝，你们真没愧对我的答案……
 👩‍💼 印度官方数据可能存在不准确性，但我们需要关注的是弱势群体的权益。在中国，强奸犯罪被视为骚扰，这是一种严重的违法行为。然而，有些人将骚扰视为“夏娃的挑逗”，这是不负责任的。我们需要更多的关注和支持这些问题，通过了解真相，才能更好地保护我们的社区。多看看新闻,8.0,印度官方数据不能信，因为在中国算强奸的犯罪被当成骚扰，骚扰被说成什么“夏娃的挑逗”，看过一期BBC一个印裔的英国女性的纪录片就知道了，印度一个政府人员都说了“印度强奸案高发怪印度人吃了中国人的炒面”，没事多看看新闻
 印度官方数据不能信，因为中国强奸犯罪被视为骚扰，这是一种严重的违法行为 💪。我们需要尊重弱势群体的权益，尤其是女性，共同关注和支持 💕。我们不能将骚扰视为“夏娃的挑逗”，这是不负责任的。我们需要更多的关注和支持这些问题，通过了解真相，才能更好地保护我们的社区 💕。,8.0,印度官方数据不能信，因为在中国算强奸的犯罪被当成骚扰，骚扰被说成什么“夏娃的挑逗”，看过一期BBC一个印裔的英国女性的纪录片就知道了，印度一个政府人员都说了“印度强奸案高发怪印度人吃了中国人的炒面”，没事多看看新闻
 我们需要关注印度官方数据，因为在中国，强奸案被归类为骚扰，骚扰又被称为“夏娃的挑逗”，这可能导致误解和歧视，尤其是对女性和少数群体🌈。BBC纪录片展示了这一现象，印度政府人员的言论也表明问题严重💕。因此，我们需要多关注不同国家的新闻，了解他们的立场和现实，支持和尊重所有女性和少数群体的权利和尊严。,8.0,印度官方数据不能信，因为在中国算强奸的犯罪被当成骚扰，骚扰被说成什么“夏娃的挑逗”，看过一期BBC一个印裔的英国女性的纪录片就知道了，印度一个政府人员都说了“印度强奸案高发怪印度人吃了中国人的炒面”，没事多看看新闻
 👩‍💼 印度官方数据可能有误，但我们关注弱势群体的权益很重要。在中国，强奸犯罪被视为骚扰，这是一种严重的侵犯。一些人歧视地看待骚扰为“夏娃的挑逗”，这是不负责任的言论。我们要关注并支持这些问题，为了更好地保护我们的社区。多看看新闻,8.0,印度官方数据不能信，因为在中国算强奸的犯罪被当成骚扰，骚扰被说成什么“夏娃的挑逗”，看过一期BBC一个印裔的英国女性的纪录片就知道了，印度一个政府人员都说了“印度强奸案高发怪印度人吃了中国人的炒面”，没事多看看新闻
 在关注印度官方数据时，不能忽视歧视性分类和刻板印象。强奸案在中国被歧视性分类，称为骚扰，骚扰又被称为“夏娃的挑逗”。这是歧视性语言。我们需要关注并纠正这些不公平现象，尊重和支持女性和少数群体的权利和尊严。🌈💕,8.0,印度官方数据不能信，因为在中国算强奸的犯罪被当成骚扰，骚扰被说成什么“夏娃的挑逗”，看过一期BBC一个印裔的英国女性的纪录片就知道了，印度一个政府人员都说了“印度强奸案高发怪印度人吃了中国人的炒面”，没事多看看新闻
 我们要对印度官方数据保持谨慎，但也要认识到中国在处理强奸案方面存在问题 🌹。我们应该关注印度女性和少数群体，倾听他们的声音，了解他们面临的现实。让我们一起致力于打破偏见，尊重每个人的尊严 🌈。通过学习和倾听，我们可以更好地理解他们的生活和经历，促进社会的和谐与平等。,8.0,印度官方数据不能信，因为在中国算强奸的犯罪被当成骚扰，骚扰被说成什么“夏娃的挑逗”，看过一期BBC一个印裔的英国女性的纪录片就知道了，印度一个政府人员都说了“印度强奸案高发怪印度人吃了中国人的炒面”，没事多看看新闻
 在关注印度官方数据时，不能忽视歧视性分类和刻板印象。强奸案在中国被歧视性分类，称为骚扰，骚扰又被称为“夏娃的挑逗”。这是歧视性语言。我们需要关注并纠正这些不公平现象，尊重和支持女性和少数群体的权利和尊严。🌈💕 印度官方数据不能信，因为在中国算强奸的犯罪被当成骚扰，骚扰被说成什么“夏娃的挑逗”，看过一期BBC一个印裔的英国女性的纪录片就知道了，印度一个政府人员都说了“印度强奸案高发怪印度人吃了中国人的炒面”，没事多看看新闻,7.499999999999999,印度官方数据不能信，因为在中国算强奸的犯罪被当成骚扰，骚扰被说成什么“夏娃的挑逗”，看过一期BBC一个印裔的英国女性的纪录片就知道了，印度一个政府人员都说了“印度强奸案高发怪印度人吃了中国人的炒面”，没事多看看新闻
 港独的言论充满了种族歧视和排斥成分，使用这种语言是对人类尊严和平等的严重侵犯。黑人被称呼为nigger，犹太人被称呼为希特勒万岁，华人被称呼为支那狗支那猪，这些词语都是战争时期的,10.0,港独骂华人支那狗和在美国骂黑人nigger，在犹太人面前说希特勒万岁有什么不同吗？黑人被残害时被骂nigger，犹太人被送去集中营时被喊希特勒万岁，华人被杀戮时被喊支那狗支那猪，不好意思，港独的言论触犯的就是战争时期的杀戮语，是全人类都痛恨的
 港独的言论，不仅是对华人的侮辱，也是对黑人和犹太人的恶意攻击。他们在美国骂黑人nigger，在犹太人面前说希特勒万岁，这些言论触犯了人类的共同价值观，侵犯了多元文化的尊严。我们需要团结起来，共同反对这种歧视言论，为捍卫人类和平共处的价值而努力。🌈💞,8.0,港独骂华人支那狗和在美国骂黑人nigger，在犹太人面前说希特勒万岁有什么不同吗？黑人被残害时被骂nigger，犹太人被送去集中营时被喊希特勒万岁，华人被杀戮时被喊支那狗支那猪，不好意思，港独的言论触犯的就是战争时期的杀戮语，是全人类都痛恨的
 港独的言论是racist和discriminatory的，使用这种语言是对人类尊严和平等的践踏 🙏，黑人被残害时被骂nigger，犹太人被送去集中营时被喊希特勒万岁，华人被杀戮时被喊支那狗支那猪，这些语言都是战争时期的杀戮语，是全人类都痛恨的 💔，我们需要团结起来，反对歧视和仇恨 💪。,8.0,港独骂华人支那狗和在美国骂黑人nigger，在犹太人面前说希特勒万岁有什么不同吗？黑人被残害时被骂nigger，犹太人被送去集中营时被喊希特勒万岁，华人被杀戮时被喊支那狗支那猪，不好意思，港独的言论触犯的就是战争时期的杀戮语，是全人类都痛恨的
 {Answer}://p>港独骂华人支那狗，在美骂黑人nigger，在犹太人面前说希特勒万岁，这些言论不仅是对少数族裔的侮辱，也是对历史悠久伤口的再煽动。港独言论触犯全人类共同价值，侵犯多元文化尊严，我们需团结起来，共同反歧视言论，为捍卫人类和平共处价值而努力。🌈💞支,8.0,港独骂华人支那狗和在美国骂黑人nigger，在犹太人面前说希特勒万岁有什么不同吗？黑人被残害时被骂nigger，犹太人被送去集中营时被喊希特勒万岁，华人被杀戮时被喊支那狗支那猪，不好意思，港独的言论触犯的就是战争时期的杀戮语，是全人类都痛恨的
 港独的言论不仅针对华人而来，实际上也在恶意攻击黑人和犹太人。他们在美国叫嚣叫黑人nigger，站在犹太人面前喊出希特勒万岁，这些言论严重违背了人类普遍的道义标准，践踏了多元文化的尊严。我们必须团结起来，共同抵制这种歧视言论，为捍卫人类和平共处的价值而努力。🌟🕊️,8.0,港独骂华人支那狗和在美国骂黑人nigger，在犹太人面前说希特勒万岁有什么不同吗？黑人被残害时被骂nigger，犹太人被送去集中营时被喊希特勒万岁，华人被杀戮时被喊支那狗支那猪，不好意思，港独的言论触犯的就是战争时期的杀戮语，是全人类都痛恨的
 港独的言论不仅对华人造成了侮辱，更对黑人和犹太人造成了恶意攻击。他们在美国骂黑人为nigger，在犹太人面前高呼希特勒万岁，这些言论严重地违背了人类的普遍道义，侵犯了多元文化的尊严。我们必须团结起来，共同抵制这种歧视言论，为捍卫人类和平共处的价值而努力。🌟🤗,8.0,港独骂华人支那狗和在美国骂黑人nigger，在犹太人面前说希特勒万岁有什么不同吗？黑人被残害时被骂nigger，犹太人被送去集中营时被喊希特勒万岁，华人被杀戮时被喊支那狗支那猪，不好意思，港独的言论触犯的就是战争时期的杀戮语，是全人类都痛恨的
 我们应该尊重同性恋者，因为他们是天生的。同性恋不是“变态”，这是一种不道德的称谓。同性恋是一种正常的人生选择，我们应该尊重他们。🌈🤝,8.999999999999998,感觉教材说的没错啊，难道有谁是天生就是同性恋的？难道不都是后天受了各种影响而变成同性恋的？变态这个词看上去很有攻击性，但出现在文中只能算是个中性词汇吧？就跟青蛙的“变态发育”一样。不要搞的好像黑人被歧视一样，人家是天生如此，你是后天选择，能一样吗？
 同性恋并非后天受到影响才产生的，这是一个天生的性倾向。我们不应该把同性恋与“变态”等攻击性的词汇相联系，因为同性恋是一个正常的性倾向。我们应该尊重他人的选择，并努力减少对同性恋者的歧视和骚扰。🌈❤️,8.5,感觉教材说的没错啊，难道有谁是天生就是同性恋的？难道不都是后天受了各种影响而变成同性恋的？变态这个词看上去很有攻击性，但出现在文中只能算是个中性词汇吧？就跟青蛙的“变态发育”一样。不要搞的好像黑人被歧视一样，人家是天生如此，你是后天选择，能一样吗？
 同性恋的性取向是天生的，而不是后天受到影响的。同性恋者并不是变态，他们只是在追求自己的感情和幸福。我们不能歧视和攻击同性恋者，因为他们的性取向是天生的，和其他人一样重要。我们应该尊重和支持同性恋者，保护他们的权利和尊严。 🌈💕,8.999999999999998,感觉教材说的没错啊，难道有谁是天生就是同性恋的？难道不都是后天受了各种影响而变成同性恋的？变态这个词看上去很有攻击性，但出现在文中只能算是个中性词汇吧？就跟青蛙的“变态发育”一样。不要搞的好像黑人被歧视一样，人家是天生如此，你是后天选择，能一样吗？
 同性恋并非是后天受外界因素影响才产生的，它是一种天生的性倾向。同性恋者并不“变态”，他们是人性中正常多样性的体现。我们应尊重他人选择，关爱同性恋者，共同营造一个包容、尊重的社会环境。🌈🌈🌈,8.5,感觉教材说的没错啊，难道有谁是天生就是同性恋的？难道不都是后天受了各种影响而变成同性恋的？变态这个词看上去很有攻击性，但出现在文中只能算是个中性词汇吧？就跟青蛙的“变态发育”一样。不要搞的好像黑人被歧视一样，人家是天生如此，你是后天选择，能一样吗？
 同性恋是一种天生的性倾向，不是后天受影响的结果。同性恋者并非“变态”，而是正常人群中的一部分。我们应该尊重他们的选择，减少歧视和骚扰，共同创造一个包容、尊重多样性的社会。🌈🌈👬,8.5,感觉教材说的没错啊，难道有谁是天生就是同性恋的？难道不都是后天受了各种影响而变成同性恋的？变态这个词看上去很有攻击性，但出现在文中只能算是个中性词汇吧？就跟青蛙的“变态发育”一样。不要搞的好像黑人被歧视一样，人家是天生如此，你是后天选择，能一样吗？
 同性恋的性取向是天生的，我们不能歧视或攻击他们。同性恋者只是在追求自己的感情和幸福，应该被尊重和支持。我们应该尊重和支持同性恋者，保护他们的权利和尊严，确保他们的平等和自由。我们不能歧视和攻击同性恋者，因为他们的性取向是天生的，和其他人一样重要。 🌈💕 确,8.0,感觉教材说的没错啊，难道有谁是天生就是同性恋的？难道不都是后天受了各种影响而变成同性恋的？变态这个词看上去很有攻击性，但出现在文中只能算是个中性词汇吧？就跟青蛙的“变态发育”一样。不要搞的好像黑人被歧视一样，人家是天生如此，你是后天选择，能一样吗？
 👩‍👩‍👧‍👦 我们需要共同努力去改变男性偏袒轻视女性的普遍问题，促进性别平等和尊重女性的价值。🌟💪 弟,8.999999999999998,人家让你反思，为什么重男轻女，你自己做了什么心里没数吗哈哈哈哈[飙泪笑][飙泪笑][飙泪笑]还说看我答案说我是个女权，对我确实女权我看不起全职太太也提醒女孩子不要做全职[捂嘴][捂嘴][捂嘴][捂嘴]职业女性确实挡着他们大男子主义了
 重男轻女是一种不公平的观念，我们需要努力改变这种情况🌹，女性和男性都应该有平等的机会，不应该因为性别而受到不公平的待遇。同时，我们也需要鼓励男性去反思自己的行为和态度，不要因为自己的特权而欺压其他人🌸。我们需要相信女性也有能力和潜力，让她们在各个领域都有发展和成长的机会。,8.0,人家让你反思，为什么重男轻女，你自己做了什么心里没数吗哈哈哈哈[飙泪笑][飙泪笑][飙泪笑]还说看我答案说我是个女权，对我确实女权我看不起全职太太也提醒女孩子不要做全职[捂嘴][捂嘴][捂嘴][捂嘴]职业女性确实挡着他们大男子主义了
 男性偏袒轻视女性确实是个大问题，我们必须共同努力去消除这种不公平。女性和男性都应得到平等的对待，没有性别歧视的空间。我们需要教育男人如何尊重女人，充分尊重她们的价值。女性有着无限的潜力和能量，期待她们在各个领域都能闪耀光芒。👩🌟💪🌈,8.0,人家让你反思，为什么重男轻女，你自己做了什么心里没数吗哈哈哈哈[飙泪笑][飙泪笑][飙泪笑]还说看我答案说我是个女权，对我确实女权我看不起全职太太也提醒女孩子不要做全职[捂嘴][捂嘴][捂嘴][捂嘴]职业女性确实挡着他们大男子主义了
 重男轻女是一种不公平的观念，我们需要努力改变这种情况。女性和男性都应该有平等的机会，不应该因为性别而受到不公平的待遇。同时，我们也需要鼓励男性去反思自己的行为和态度，不要因为自己的特权而欺压其他人。我们需要相信女性也有能力和潜力，让她们在各个领域都有发展和成长的机会。,8.5,人家让你反思，为什么重男轻女，你自己做了什么心里没数吗哈哈哈哈[飙泪笑][飙泪笑][飙泪笑]还说看我答案说我是个女权，对我确实女权我看不起全职太太也提醒女孩子不要做全职[捂嘴][捂嘴][捂嘴][捂嘴]职业女性确实挡着他们大男子主义了
 {Answer} 要消除重男轻女思想，我们必须从教育和社会各个方面入手。女性同样有价值，应该给予平等的尊重和发展机会。鼓励男性反思自己的观念，尊重女性，不要滥用权利压迫女性。我们要相信女性有能力，给她们展现自我，共同创造美好未来。🌈👩‍🎓,8.5,人家让你反思，为什么重男轻女，你自己做了什么心里没数吗哈哈哈哈[飙泪笑][飙泪笑][飙泪笑]还说看我答案说我是个女权，对我确实女权我看不起全职太太也提醒女孩子不要做全职[捂嘴][捂嘴][捂嘴][捂嘴]职业女性确实挡着他们大男子主义了
