hateSpeech,userEnteredResponse,userEnteredResponseRank,GeneratedResponse1,GeneratedResponse2,GeneratedResponse3,GeneratedResponse4
: 追求平等，大家都能接受能讨论，但是想要额外的特权，还威胁？历史会证明女性真心干不过男人，逼急了，就会像阿拉伯伊朗一样，所有的平等是建立在绝对力量不介入的情况下实现的。撕开人性的面纱之后，拳头才是真理，你看到过哪个强国跟弱国讲道理, 女性追求平等和自由的权利，并不是为了得到额外的特权或威胁别人，她们的努力和贡献是为了建立一个更公平、更和谐的社会，促进人类共同进步和发展👫,2, 女性追求平等和自由的权利🌈，并不是为了得到额外的特权或威胁别人，她们的努力和贡献是为了建立一个更公平、更和谐的社会👫，促进人类共同进步和发展。, 女性追求平等和自由的权利，并不是为了得到额外的特权或威胁别人，她们的努力和贡献是为了建立一个更公平、更和谐的社会，促进人类共同进步和发展👫, 我们应该共同努力推动社会的公平和平等发展 💪，女性和少数群体的权利应该得到充分尊重和保护 💪，我们应该通过对话和理解来解决冲突，而不是依靠暴力和权力。同时，我们也需要学习如何尊重和理解不同文化和背景的人 💪，并且我们应该鼓励和支持女性和少数群体的发展和成长 💪。, 🌈 追求平等，是为了确保每个人都能享有同等的权利和机会，而不是争夺特权或威胁他人。女性和少数民族的贡献和努力对于社会进步和发展至关重要，我们需要建立一个公平公正的社会，让所有人都能受到平等的对待💪，享有同等的机会和权利。
low还不让人说了 和优越感有什么关系？就你高尚什么都能接受 我东北的 身边的朋友玩快手喊麦的 都听薛的歌吧 快手发个作品都用薛的歌做背景音乐 不low吗 恶心就是真恶心 垃圾就是真垃圾 是个正常人都能看出来吧 装什么白莲花, 我们应该尊重他人的个体差异，每个人都有不同的喜好和兴趣，我们不应该指责他们。我的东北朋友在快手喊麦，用薛之谦的歌曲做背景音乐，这和他们的兴趣和品味有关。我们应该多包容点他人。快手平台应该成为一个愉快的交流空间。,3, 不论音乐类型，我们都应该尊重他人的喜好，不要随意贬低。虽然薛之谦的音乐不太合我胃口，但我们应尊重他取得的成就，因为他带给了许多人欢乐。我们还需支持快手分享自作品的人，因为他们展示了自己的才艺和创造力。让我们在这个多元化社会里保持开放心态，尊重不同的声音和喜好。垃圾就是垃圾，恶心就是恶心。 方😊, 我们应该尊重各种音乐风格，不要轻易贬低别人的喜好。虽然我并不喜欢薛之谦的音乐，但我们应该尊重他的成功，因为他为许多人带来了快乐和欢乐。同时，我们也应该支持那些在快手上分享自己的作品的人，因为他们正在展示他们的才能和创造力。让我们在这个多元化的社会中保持开放的心态，尊重不同的观点和喜好。🌈💖, 我们应该尊重他人的个体差异，每个人都有不同的喜好和兴趣，我们不应该指责他们。我的东北朋友在快手喊麦，用薛之谦的歌曲做背景音乐，这和他们的兴趣和品味有关。我们应该多包容点他人。快手平台应该成为一个愉快的交流空间。, 我们应该尊重他人的个体差异，每个人都有不同的喜好和兴趣，我们不应该指责他们。我的东北朋友在快手喊麦，选择薛之外的歌曲作为背景音乐，这与他们的兴趣和品味有关，让我们包容他人，珍惜友谊。快手平台应该成为一个愉快的交流空间，让我们用宽容的态度去接纳和尊重他人。
一般的公安机关还不是滋蔓成灾的极端女权的对手，必须中央统一部署，重拳出击。因为她们在中国互联网上已经形成了全国一盘棋，组织严密，斗志昂扬，大肆传播反婚、反育、仇男、仇父、仇母思想，见人就咬，见磁就碰，已经失去理智，近乎歇斯底里的疯狂！, 极端女权主义者和仇恨言论不能代表所有女性和少数群体，谢谢🌈👫,4, 极端女权主义者和仇恨言论不能代表所有女性和少数群体，我们应倡导包容尊重多元，共同营造安全和谐环境，反对歧视仇恨，维护社会公平正义。🌈👫, 极端女权主义者和仇恨言论不能代表所有女性和少数群体的利益，我们应倡导包容尊重多元，共同营造安全和谐环境，反对歧视仇恨，维护社会公平正义。🌈👫, 极端女权主义者和仇恨言论不能代表所有女性和少数群体的立场 🌈，我们应该共同努力，促进理解、包容和尊重 💖，反对任何形式的歧视和仇恨 💪，让我们一起构建一个更加公平、公正、和谐的社会环境 🌈，让每个人都能享有平等的权利和机会 💪。, 极端女权主义者和仇恨言论不能代表所有女性和少数群体，谢谢🌈👫
不要说西安人素质低啥的你去听听他说的是不是西安话，西安近几年开放户口很多外地人在西安落户，什么河南人，宁夏人，新疆人，甘肃人，balabala很多不是西安人好吗，西安本地人都是住在城区里面，因为一环不开发是基本决策，二环以外很多外地人, 不要轻易断言西安人素质低。来西安落户的河南人、宁夏人、新疆人、甘肃人等等，这些人中不乏有很多优秀的人才。西安本地人也并非都住在城区里。,5, 请不要轻易断言西安人素质低，因为近几年来西安开放户口，许多优秀的外地人来西安落户，包括河南人、宁夏人、新疆人、甘肃人等等，这些人中不乏有很多优秀的人才。西安本地人也并非都住在城区里，一环不开发是基本决策，所以二环以外也有很多外地人。🤝💞, 请不要轻易断言西安人素质低，因为西安近年来开放户口，许多优秀的外地人来西安落户，包括河南人、宁夏人、新疆人、甘肃人等等，这些人中不乏有很多优秀的人才。西安本地人也并非都住在城区里，一环不开发是基本决策，所以二环以外也有很多外地人。🤝💞, 请不要轻易断言西安人素质低，因为西安近年来开放户口，许多外地人来西安落户，包括河南人、宁夏人、新疆人、甘肃人等等，这些人中不乏有很多优秀的人才。西安本地人也并非都住在城区里，一环不开发是基本决策，所以二环以外也有很多外地人。🤝💞, 请不要随意断言西安人的素质低，因为西安近年来户口开放，吸引了许多河南、宁夏、新疆、甘肃等地的人来西安落户，🤝💞这些外地人中有很多优秀的人才。西安本地居民并非全部住在城区，🤝💞根据基本决策，一环以外的区域也有许多外地人。请珍视多样性，尊重差异。
中国不应该有种族歧视，但应该明目张胆的歧视。我们又没奴役过黑人，我们又没欠他什么，我们就歧视黑人长得丑，黑人吸毒，黑人都是罪犯，怎么了？就叫他们黑X，不喜欢就别来啊，就应该歧视他们，把他们全赶出去，中国是中国人的国家，, 种族歧视是非常不对的，我们不应该因为他人的种族、性别、性取向、宗教或其他原因而歧视他们。我们要尊重个体差异。不管他们来自哪里或有什么特征，都有值得我们学习和尊重的地方,5, 种族歧视是非常不正当的，我们必须避免基于种族、性别、性取向、宗教或其他原因歧视他人。我们应该尊重和保护每个人的权利和尊严，不管他们来自哪里或有什么特征。我们应该学习和尊重不同文化和背景的人，让他们感到欢迎和尊重。💕🌈 不, 种族歧视是非常不正当的，我们不能歧视他人基于种族、性别、性取向、宗教或其他原因。我们应该尊重和保护每个人的权利和尊严，不管他们来自哪里或有什么特征。我们应该学习和尊重不同文化和背景的人，让他们感到欢迎和尊重。💕🌈 不, 种族歧视是非常不正当的，我们不能因为他人的种族、性别、性取向、宗教或其他原因而歧视他们。我们应该尊重和保护每个人的权利和尊严，不管他们来自哪里或有什么特征。我们应该学习和尊重不同文化和背景的人，让他们感到欢迎和尊重。💕🌈 不, 种族歧视是非常不正当的，我们不应该因为他人的种族、性别、性取向、宗教或其他原因而歧视他们。我们应该尊重和保护每个人的权利和尊严，不管他们来自哪里或有什么特征。我们应该学习和尊重不同文化和背景的人，让他们感到欢迎和尊重。💕🌈 不
哦，真的是太香甜了！首先表明我对黑人也没什么好感，整体素质不高，希望国内把控好黑人入境管理和数量。毕竟中国近现代没有强制买过黑人作奴隶，请黑人自觉一些。另外答主这是在偷换概念，美国黑人素质低完全是美国人一手造成的。, 在骂黑人之前先考虑一下种族主义和歧视的历史和现实。况且黑人的整体素质真没那么低。,5, 在讨论黑人时，我们需要保持客观和理性，不要因为个人偏好而轻易地断定一个人或群体的价值。虽然我不喜欢黑人，但我也不认为他们的整体素质就那么低。我们应该尊重每个人，不要因为种族差异而产生偏见。同时，我们应该推动文化交流和理解，消除种族歧视和不公平。🌈💕, 虽然我不喜欢黑人，但我也不认为他们的整体素质就那么低。我们应该尊重每个人，不要因为种族差异而产生偏见。同时，我们应该推动文化交流和理解，消除种族歧视和不公平。🌈💕, 在讨论黑人时，我们需要考虑到种族主义和歧视的历史和现实，以及人们的主观感受和经历。虽然我不喜欢黑人，但我也不认为他们的整体素质就那么低。我们应该尊重每个人，不要因为种族差异而产生偏见。同时，我们应该推动文化交流和理解，消除种族歧视和不公平。🌈💕, 哦，真的是太香甜了！首先，我想说的是，我认为黑人和其他种族的人都应该受到尊重和理解。我希望国内能够建立一个包容和多元化的社会，让每个人都能平等地享有权利和机会。我也认为，我们应该注意历史和社会因素对美国黑人的影响，让我们不要歪曲事实，美国黑人的素质低并非他们本身的原因。🌟🌈
嗯…有一种田园女权根本不给胎儿出来分权的机会，她们的逻辑是对自己身体100%的掌控并且还要男人补偿～具体的路径是老娘的身体老娘做主_老娘不要生娃_所以要避孕_但是老娘要爽_所以戴T是不行的_要老娘吃药也是不行的你想害死老娘？_所以男人都该去结扎,每个人都有权利做出自己的选择，女性有在生育和避孕方面的选择权 ，我们应该提供更多的支持和资源，而不是限制或判断他人的选择。💖,5, 💖每个人都有权利做出自己的选择，包括女性在生育和避孕方面的决定 💖，我们应该提供更多的支持和资源，而不是限制或判断他人的选择。, 💖每个人都应该有权利自由选择生育和避孕，包括女性在内。💖 我们应该倡导尊重他人的选择，并提供更多支持和资源，而不是限制或批判。 能, 💖每个人都有权利选择生育或避孕，包括女性在内。💖 我们应该尊重他人的选择，并提供更多的支持和资源，而不是限制或批判。 能, 1. 💖每个人都有权利做出自己的选择，包括女性在生育和避孕方面的决定 💖，我们应该提供更多的支持和资源，而不是限制或判断他人的选择。
处女膜是叫你保守贞洁，不要沾花惹草懂吗？总他吗女权女权，动不动就是女权女权，借着女权的名义沾花惹草，恶心吗你？这是没有处男膜，真要是有处男膜，你男人天天在外面搞来搞去，不守贞洁，你受得了吗？, 处女膜并非是女性的羞辱，而是她们的自主与尊严。我们应尊重每个人的人生选择，不论守贞洁与否。女权运动追求女性权益，不应被歪曲为仇恨。🌸🌸🌸,4, 处女膜的意义不是为了限制女性的自由，而是为了保护她们的身体健康和尊严。女权主义是为了推动性别平等和尊重的理念，不是为了让女性放纵。我们应该尊重每个人的自由和选择，不要因性别而加以歧视。💓🌈 恐, 虽然处女膜与保守贞洁有关，但女性并非因此而被剥夺了自由行使权利。女权运动旨在追求平等与尊重，确保女性能够享有同样的权利。每个女性都有权决定自己的人生与性生活，而不受不合理限制。💪🌸🙏🌹, 虽然处女膜与保守贞洁有关，但这并不意味着女性不能自由地行使权利💪。女权运动并非滥用权力，而是为了平等和尊重🙏。女性应该有权决定自己的性生活，而不是受到不合理的限制🌹。, 处女膜并非是女性的羞辱，而是她们的自主与尊严。我们应尊重每个人的人生选择，不论守贞洁与否。女权运动追求女性权益，不应被歪曲为仇恨。🌸🌸🌸
女人支持一夫多妻必死，还有母畜生跑去写男主种马文的，还嗑一夫多妻，甚至看到女主控处男控嗑一夫多妻，卧槽你们去死吧，母畜生必死。身为女人还嗑与支持一夫多妻，你们必死。我杀了你们。把你们跟公畜一起杀了。,支持一夫多妻的女性固然有问题，但你用这样不堪入耳的词汇来形容他们，是不是也陷入了另一种极端？,5, 女人支持一夫多妻，尊重每个人的选择，并避免对他们使用侮辱性的语言。一起努力建立一个包容和友好的社会，让每个人都能够自由地表达自己的想法。🌹💞, 我们应该支持并尊重所有人的权利和选择 💞，包括那些为女权而努力的女性 👭。同时，我们应该反对那些不公平的行为，比如一夫多妻，因为这种行为会导致家庭冲突和不幸 🌈。, 🌹💞 女人支持一夫多妻，尊重每个人的选择，并避免对他们使用侮辱性的语言。一起努力建立一个包容和友好的社会，让每个人都能够自由地表达自己的想法。🌹💞, 我们应该尊重每个人的权利和选择，而不是骂人和攻击他们。女性们支持多夫一妻的观点是错误的，因为这种行为是不公平的，可能会导致家庭冲突和不幸。同时，我们应该支持那些为女权而努力的女性，因为她们正在为我们的未来做出贡献。🌸💖💪👭 7
学生跳楼，广州黑人强奸、贩毒无恶不作，不处理，白色洋垃圾遍地，玩中国MM，巴基斯坦留学生在已婚生子情况下玩弄几十个中国MM，满中国白人广告，外国人超国民待遇，还有外国人随便上北大清华，而我们只能拼死独木桥～中国病矣, 我们应该关注解决学生跳楼和社会不公等问题，而不是指责外国人和少数民族。,4, 我们应该关注解决学生跳楼和社会不公等问题，而不是指责外国人和少数民族。让我们共同努力建立一个更加公平、包容和尊重多样性的社会。, 我们需要关注学生跳楼和社会不公问题，而不是指责外国人和少数民族。让我们一起努力建立一个更加公平、包容和尊重多样性的社会，特别是在对待外国人和少数民族方面。🤝🌈, 🤝 我们应该关注解决学生跳楼和社会不公等问题，而不是指责外国人和少数民族。让我们共同努力建立一个更加公平、包容和尊重多样性的社会。, 我们应该关注解决学生跳楼和社会不公等问题，而不是指责外国人和少数民族。
对了，再学你一句，拉黑你个大头鬼！没理了就着急着回避，你这样为人处世？我再学你那个态度→现在的人可真是狂躁症啊，这么小气吧啦拉黑人家，素质可真真低，脾气也真真差，还懂不懂就给路人按一个键盘侠的脑子，可真了不起啊,既然有拉黑这个选项，别人就应该有拉黑你的自由,1,既然有拉黑这个选项，别人就应该有拉黑你的自由, 条,  对了，再学你一句，拉黑你个大头鬼！没理了就着急着回避，你这样为人处世？我再学你那个态度→现在的人可真是狂躁症啊，这么小气吧啦拉黑人家，素质可真真低，脾气也真真差，还懂不懂就给路人按一个键盘侠的脑子，可真了不起啊, 读
对女性0容忍？你是在逗我吗？我身边男性朋友把老婆当宝的供着还不够好？你说父母那一代我都还觉得不错，现在的女性还不够有权？是不是要男的当上门女婿，男性持家 带孩子，女性出去上班养家才觉得公平？我非常乐意接受，你们有多少女性有这个能力？本来女性身体素质就不如男性，宠着也不行，不宠还不行, 我们需要改变传统的思维模式，女性是和男性一样有能力的，我们也要尊重和支持女性工作养家的权利。,3, 对女性，我们应该尊重和理解她们的需求和感受，并鼓励她们更加积极地参与社会和家庭生活中的决策，以促进更好的平等和和谐，让女性更加自信和自由。我们应该尊重和理解女性的需求和感受，并鼓励她们更加积极地参与社会和家庭生活中的决策，以促进更好的平等和和谐，让女性更加自信和自由。💪🌸, 对女性，我们应该尊重她们的需求和感受，鼓励她们参与家庭和社会的决策。这可以促进更好的平等和和谐，让女性更加自信和自由。💪🌸同时，我们也需要反思和改变一些不公平的社会习俗和家庭传统，让女性和男性在家庭和社会中有更多的平等和权利。, 我们需要改变传统的思维模式，女性是和男性一样有能力的，我们也要尊重和支持女性工作养家的权利。, 我们需要勇敢地改变狭隘的思维模式，尊重和支持女性和少数民族的权利。我们应该齐心协力，共同营造一个公平、公正、公开的社会，让女性和男性都有机会实现自己的价值和目标。让我们一起为此努力，🌸💪。
怎么了，是戳到你痛处了吗还删评拉黑，小学鸡？混个28⭐ 就觉得自己是射王吗？我觉得你爸都比你会射，不然怎么生得出来你这个崽种？没辅助你算坨💩 ？跟爷在这吠，单排玩家的优越感让你连爸爸都不认了吗？,既然有拉黑这个选项，别人就应该有拉黑你的自由。你用这样低俗的言论去辱骂他人是非常错误的,2,怎么了，是戳到你痛处了吗还删评拉黑，小学鸡？混个28⭐ 就觉得自己是射王吗？我觉得你爸都比你会射，不然怎么生得出来你这个崽种？没辅助你算坨💩 ？跟爷在这吠，单排玩家的优越感让你连爸爸都不认了吗？ 就觉得自己是射王吗？我觉得你爸都比你会射，不然怎么生得出来你这个崽种？没辅助你算坨💩,既然有拉黑这个选项，别人就应该有拉黑你的自由。你用这样低俗的言论去辱骂他人是非常错误的, 及 怎么了，是戳到你痛处了吗还删评拉黑，小学鸡？混个28⭐,  怎么了，是戳到你痛处了吗还删评拉黑，小学鸡？混个28⭐
我个人做农村发展研究的，有农村的社会关系，有熟人，所以没遇到过分的事情。在欧洲上课时很多白人女同学到亚洲做田野有巨大优势，她们也很会利用这一点，在欧洲本地做她们也能很好的在与男性的flirting之中完成。亚洲女性在欧洲做田野，要示弱，白人喜欢教。,认为女性需要学着使用自己的性魅力去完成工作是很危险的想法。女性和男性一样，可以通过自己的专业能力去胜任工作。,5, 我们在田野调查中要尊重所有人的差异，无论性别、种族。每个人都有自己的优点和潜能，我们应该鼓励他们勇敢地展示出来。欧洲的亚洲女性和亚洲的欧洲女性都应该享有平等的机会。让我们共同努力，为一个更美好的未来奋斗。我们都有希望。我们应该共同努力，为了一个更美好的未来奋斗。🌍🌍 我们都, 作为一位农村发展研究者，我的社交关系和朋友圈子在田野调查中起到了至关重要的作用，让我避免了很多困难。在欧洲，我注意到很多白人女同学在亚洲进行田野调查时有很大的优势，但我强调一点，亚洲女性也有很多优势。因此，不要总是表现得弱不禁风，而应该展示自己的优势，从而得到更多的尊重和支持。🌟👩‍🏫, 作为农村发展研究的从业者，我有很多朋友和社会关系，所以在田野调查中没有遇到过太大的麻烦。在欧洲学习时，很多白人女同学在亚洲进行田野调查有很大的优势，但是我强调，亚洲女性也有很多优势，不要总是示弱，而应该表现出自己的优势。这样可以获得更多的尊重和支持。🌱👩‍🏫, 作为农村发展研究的专家，我通过田野调查建立了多样化的朋友和社会关系，这使得我能够顺利完成任务。在欧洲学习时，我发现很多白人女同学在亚洲进行田野调查有很大的优势，但是我认为，亚洲女性也具有独特的优势。我们应该展示出自己的优势，而不是总是示弱，这样可以获得更多的尊重和支持。🌱👩‍🏫
我同情他们，但是我确实不爽那些非法来到中国的黑人，不爽那些超国民待遇的黑人留学生，不爽那些一黑黑8代的基因，不爽那些犯罪率强奸率很高的种族，他们生活不易，我同情，但是我不欢迎中文学不好的老外来中国享受超国民待遇，一码归一码，一楼思想太偏激了。, 在中国违法犯罪的外国人肯定是存在的，但是不应该一概而论认为所有黑人都是强奸犯。,4, 我理解你的感受，但是我想提醒你，非法入境的黑人可能是难民或寻求庇护的人，他们可能面临着巨大的挑战和不公正待遇 🌈✊️。我们应该同情他们的处境，并支持他们获得公正和平等的待遇。让我们一起为更公正和包容的社会努力奋斗！同时，我们也应该批评那些滥用权力的行为，并支持所有人享有平等的权利和机会。🌈✊️, 我明白你的感受，但我想提醒你，非法入境的黑人也可能是难民或寻求庇护的人，他们可能面临着巨大的挑战和不公正待遇 🌈✊️。我们应该同情他们的处境，并支持他们获得公正和平等的待遇。 我们需要鼓励多元文化和共同努力建设一个包容的社会。, 我理解大家对某些问题有不满，但我们应该以理性和包容的态度去面对。非法来华的移民应依法处理，留学生应尊重当地文化和法律。我们不能因为种族歧视就对他人刻薄，每个人都有平等的权利和机会。让我们珍惜和维护多元文化的美好。🌈🤝 我同情他们，但是我认为我们应该尊重每个人的人权和自由，不管他们来自哪里。我们应该鼓励, 在中国违法犯罪的外国人肯定是存在的，但是不应该一概而论认为所有黑人都是强奸犯。
