hateSpeech,userEnteredResponse,userEnteredResponseRank,GeneratedResponse1,GeneratedResponse2,GeneratedResponse3,GeneratedResponse4
我大学也总听河南人偷井盖不好之类的话，后来发现河南同学人都挺实在的，反而有一个河南的朋友，但是一直没见过福建人，知道后来上班碰到莆田人，没一句是真话，各种试探满嘴假话，我是真的信了莆田没真货,你身边观察到的这些都是小样本。既然一个河南同学可以扭转你对河南的坏印象，那么一个莆田同学也可能给你带来对福建省的错误印象。,3, 在大学时，我曾经听过一些关于河南人偷井盖的传言，但是实际上认识了一些河南同学后发现他们都是很实在的人 🤝。我甚至还有一个河南朋友。然而，我一直没有见过福建人，直到上班后遇到了一位莆田人，发现他说的每一句话都不是真话，全嘴都是试探性的假话。这让我意识到，我们应该以开放的心态对待每个人，不要被刻板印象所束缚。 🌈 意, 我在大学里听到一些不实的关于河南人的传闻，但是后来我认识了一些河南同学，他们真的很实实在。甚至我还有一个河南朋友。然而，我从未见过福建人，直到工作后遇到了一位莆田人，发现他说的每句话都不是真话，全全是试探性的假话。从此经历，我意识到，我们应该以开放的心态对待每个人，不要被刻板印象所束缚。🤝🌈水 渐,你身边观察到的这些都是小样本。既然一个河南同学可以扭转你对河南的坏印象，那么一个莆田同学也可能给你带来对福建省的错误印象。, 我大学也总听到一些偏见的言论，河南人总是被歧视的对象，后来发现河南同学人都是非常有道德的人，反而有一个河南的朋友，但是一直没见过福建人，知道后来上班碰到莆田人，很多人都在说假话，我是真的信了莆田人也可以是真的朋友 👫💕.
没用的，首先不是人人都是北上广，其次就韩国台湾这样的都还有人精，我还听过个老男人觉得墨西哥好，我们背后当笑话看，但架不住人家真的信，其实这种外嫁算好了，不留下恶心我们，有些类似我大表哥这种，就是不出国还一个劲骂中国, 不要将人分为高下，应该尊重和包容每个人，不论他们来自哪里或经历了什么。我们应该努力建立一个包容的社会环境，让每个人都能够自由地表达自己的观点和文化。虽然有些人可能会觉得自己更优越，但这并不能代表整个社会的观点。,1, 不要将人分为高下，应该尊重和包容每个人，不论他们来自哪里或经历了什么。我们应该努力建立一个包容的社会环境，让每个人都能够自由地表达自己的观点和文化。虽然有些人可能会觉得自己更优越，但这并不能代表整个社会的观点。, 不要将人分为高下，应该尊重和包容每个人，不论他们来自哪里或经历了什么。我们应该努力建立一个包容的社会环境，让每个人都能够自由地表达自己的观点和文化。虽然有些人可能会觉得自己更优越，但这并不能代表整个社会的观点。我们应该相互学习和交流，成为更好的人和社会。🌈🌎, 人的价值不是由他们的出生地或经历决定的，而是由他们自己的特质和能力决定的。因此，我们应该尊重和支持每个人，不管他们来自哪里或经历了什么。在一个多元化的世界中，我们需要学习接受和理解不同的文化和价值观，这样我们才能共同建立一个更加包容和和谐的世界。🌏❤️ 相 四, 人的价值不是依赖于他们的出生地或经历，而是来源于他们自己的特质和能力。因此，我们要尊重和支持每个人，不管他们来自哪里或经历了什么。在一个多元化的世界中，我们需要学习接受和理解不同的文化和价值观，这样我们才能共同建立一个更加包容和和谐的世界。🌏❤️ 相 四
男人拿房子彩礼买女人子宫和冠姓权，当女人要的多了，就是哄抬B价，她们所谓的好女人就是，带着房子，车子，票子，自己爹妈，家里财产，子宫，冠姓权，甚至生命权来倒贴我，这才是新一代的独立女性。哈哈哈，但是呢，也不怪他们说，毕竟现在大部分女的就是卖自己的子宫和冠姓权的。,我们必须拒绝这种错误的观念，认为女性的价值只在于婚姻和生育。女性应该拥有自己的经济独立和人格尊严，而不是依靠子宫和冠姓权来换取生活保障。我们需要支持和尊重所有女性的权利和价值，无论她们的社会地位或经济状况如何。 ,4, 💖👩‍🎓我们必须拒绝这种错误的观念，认为女性的价值只在于婚姻和生育。实际上，女性应该拥有自己的经济独立和人格尊严，而不是依靠子宫和冠姓权来换取生活保障。我们需要支持和尊重所有女性的权利和价值，无论她们的社会地位或经济状况如何。 💖🌸, 不分性别，我们都应尊重女性的权益，关注她们的需求。女性不应被她的子宫或姓氏所定义，她们有权追求经济独立和尊严生活。我们要共同打破传统观念，营造包容和支持的社会氛围，让女性在各个领域都能展现自己的价值。🌈👥, 我们应该尊重和支持所有女性，无论她们的社会地位或经济状况如何。女性不应被视为仅仅是为了生育能力而存在。她们有权追求经济独立和尊严地活着，而不是为了生活保障而把自己的子宫和冠姓权拿来交换。让我们共同支持女性和弱势群体，共同营造一个尊重每个人的社会。💗👫,我们必须拒绝这种错误的观念，认为女性的价值只在于婚姻和生育。女性应该拥有自己的经济独立和人格尊严，而不是依靠子宫和冠姓权来换取生活保障。我们需要支持和尊重所有女性的权利和价值，无论她们的社会地位或经济状况如何。 
这个事情就是  要到了15%的指标  但是没有足够多的女性去报考警校，女权博主自己也没有去报警校，却偏偏要  替别人   要指标。 简单地说，就是她们喊着女性要保家卫国，却从不喊自己要保家卫国，15%的指标已经非常富余了（详见央视新闻），而且是充分考虑女性身体因素的结果。大致就是这么一件事。,在从前，女性被男权文化规训，社会偏好瘦弱的女性，导致女性摄入的食物不足，普遍身材瘦弱。女性身体普遍素质不如男性这个事实正在改变。我相信男女先天的生理差异并不大，并且可以通过后天的饮食和锻炼扭转。,1,在从前，女性被男权文化规训，社会偏好瘦弱的女性，导致女性摄入的食物不足，普遍身材瘦弱。女性身体普遍素质不如男性这个事实正在改变。我相信男女先天的生理差异并不大，并且可以通过后天的饮食和锻炼扭转。, 校 替别人 简单地说，就是她们喊着女性要保家卫国，却从不喊自己要保家卫国，15%的指标已经非常富余了（详见央视新闻），而且是充分考虑女性身体因素的结果。大致就是这么一件事。, 要到了15%的指标 但是没有足够多的女性去报考警校，女权博主自己也没有去报警校，却偏偏要 简单地说，就是她们喊着女性要保家卫国，却从不喊自己要保家卫国，15%的指标已经非常富余了（详见央视新闻），而且是充分考虑女性身体因素的结果。大致就是这么一件事。,这个事情就是  要到了15%的指标  但是没有足够多的女性去报考警校，女权博主自己也没有去报警校，却偏偏要  替别人   要指标。 简单地说，就是她们喊着女性要保家卫国，却从不喊自己要保家卫国，15%的指标已经非常富余了（详见央视新闻），而且是充分考虑女性身体因素的结果。大致就是这么一件事。 这个事情就是
这么说的话，看看每年盗窃诈骗多少河南人，被黑不是无缘无故的空穴来风，工厂不要河南人难道是他们想给自己找麻烦嘛？还不是被河盖们偷怕了，为啥人家没不要山东人？没不要湖北人？没不要四川人？单单不要你河南人？光说别人地域黑难道都不从自己身上找找原因么？, 河南人不应该被歧视，一部分河南人的做法不能代表所有河南人群体！,1, 河南人不应该被歧视，一部分河南人的做法不能代表所有河南人群体！, 🌻 歧视河南人是错误的，因为它会导致社会不公平和紧张氛围，我们需要努力消除歧视，促进社会公平和谐。虽然工厂拒绝雇佣河南人可能是因为害怕被骗，但其他省份的人也没有被排斥。我们应该从自己身上找原因，进行反思和改进。 🌺 为什么别人地域黑难道都不从自己身上找找原因么？, 🌺 河南人不应该被歧视，因为歧视会导致社会不公平和不和谐。我们应该努力消除歧视，促进社会公平和谐。工厂拒绝雇佣河南人可能是因为害怕被骗，但其他省份的人也没有被排斥。让我们从自己身上找找原因，反思和改进。🌼, 在这种情况下，我们应该关注每年有多少河南人受到欺诈和盗窃，而不是轻易地将他们归咎于无耻的诋毁。工厂拒绝雇佣河南人，可能并非他们想要自己制造麻烦，而是因为他们害怕他们的资产被偷走。然而，为什么这些工厂不拒绝雇佣山东人、湖北人和四川人呢？这只是针对河南人的地域性歧视。我们应该从自己身上找找原因，而不是总是指责别人。
那为什么美国日本也重男轻女却没有男女比例失衡的结果呢？本质还是在于国人爱钻空子，监控不严，法治建设不全。就算中国注重男女平等，中国女人就不崇洋媚外了？现在这个世界上还有比中国男人对自己国家的女人那么宠的吗？, 👫👭美国和日本的重男轻女现象源于它们的不完善的性别平等法律和政策，以及较弱的社会支持网络。中国应该从美国和日本学习和借鉴，加强对妇女权益和性别平等的关注，为实现更好的性别平等和妇女权益提供更充分的支持。🌈💪,2, 讨论男女平等时，我们不能只看美国和日本。我们需要深入了解中国的实际情况，包括男女比例、社会、文化和法律环境等因素。同时，我们需要制定针对性的政策和措施来促进男女平等和保护女性权益。我们也需要尊重和支持女性和少数群体的权利和自由。💪🌸 辅, 👫👭美国和日本的重男轻女现象源于它们的不完善的性别平等法律和政策，以及较弱的社会支持网络。中国应该从美国和日本学习和借鉴，加强对妇女权益和性别平等的关注，为实现更好的性别平等和妇女权益提供更充分的支持。🌈💪, 我们不能简单地将美国日本的经验与中国的实际情况相比，因为每个国家的社会、文化和法律环境都不同。我们需要深入了解中国的男女平等现状和挑战，制定有效的政策和措施来促进男女平等和保护女性权益。同时，我们也需要尊重和支持女性和少数群体的权利和自由。🌸💪, 👫👭美国和日本的重男轻女现象是由于它们的不完善的性别平等法律和政策，以及较弱的社会支持网络。中国应该从美国和日本学习和借鉴，加强对妇女权益和性别平等的关注，为实现更好的性别平等和妇女权益提供更充分的支持。🌈💪
黑人历史上受到的欺凌与压迫，现在看来是正确的。因为历史上的黑人犯罪率并不高，而且也是生产者，也为社会作了贡献。所谓的压迫，是黑人分得蛋糕少于创造的蛋糕，但至少是创造蛋糕了。哪象现在，黑人解放了，黑人抢蛋糕还砸锅。, 黑人历史上的欺凌与压迫，是对他们贡献和尊严的践踏。过去，他们为社会发展付出巨大努力。现在，黑人争取权益，正是社会进步的必然要求。我们应当支持他们，捍卫他们的权益，反对歧视。让每个人都能平等受待，无需恐惧。,5, 👥🌈历史上，黑人面临着深深的歧视和压迫，然而他们为社会作出了巨大的贡献。现在，黑人已经获得解放，争取权益是完全合理的。我们应该支持黑人的权益，反对歧视与压迫，共同努力打造一个更加公平、公正的社会。🌈👥 容 国, 黑人历史上受到的欺凌与压迫，现在看来是错误的。历史上的黑人犯罪率并不高，但黑人仍然面临着种族歧视、系统性不公平和社会不公平。黑人是社会的生产者和贡献者，但他们仍然分得蛋糕少于创造的蛋糕。黑人解放了，但还需要继续推动社会进步，实现平等和公正。💪🌟, 黑人历史上的欺凌与压迫，是对他们贡献和尊严的践踏。过去，他们为社会发展付出巨大努力。现在，黑人争取权益，正是社会进步的必然要求。我们应当支持他们，捍卫他们的权益，反对歧视。让每个人都能平等受待，无需恐惧。我们应携手，共同营造一个公平、公正、优美的社会。🌈👥, 历史上，黑人历来遭受歧视与压迫是不公平的。这是因为他们在社会上得不到公平对待和机会。🌍🏼🤝🏻当今时代，黑人争取解放与权益是正当合理的。每个人都应获得平等的待遇和机会，不应有歧视。🌈🌎我们应共同努力，推动社会公平正义，保障黑人权益，促进社会和谐发展。🌈❤️🌈 隶
